Symbol,Name,Country,IPO Year,Exchange,Cleaned Symbol
IPAR,Inter Parfums Inc. Common Stock,United States,,NASDAQ,IPAR
IPDN,Professional Diversity Network Inc. Common Stock,United States,2013,NASDAQ,IPDN
IPGP,IPG Photonics Corporation Common Stock,United States,2006,NASDAQ,IPGP
IPHA,Innate Pharma S.A. ADS,France,2019,NASDAQ,IPHA
IPLDP,Interstate Power & Light Company Perp Prd Ser D,United States,,NASDAQ,IPLDP
IPSC,Century Therapeutics Inc. Common Stock,United States,2021,NASDAQ,IPSC
IPVI,InterPrivate IV InfraTech Partners Inc. Class A Common Stock,United States,2021,NASDAQ,IPVI
IPVIU,InterPrivate IV InfraTech Partners Inc. Units,United States,2021,NASDAQ,IPVIU
IPW,iPower Inc. Common Stock,United States,2021,NASDAQ,IPW
IPWR,Ideal Power Inc. Common Stock,United States,2013,NASDAQ,IPWR
IQ,iQIYI Inc. American Depositary Shares,China,2018,NASDAQ,IQ
IRBT,iRobot Corporation Common Stock,United States,2005,NASDAQ,IRBT
IRCP,IRSA Propiedades Comerciales S.A. American Depositary Shares,Argentina,,NASDAQ,IRCP
IRDM,Iridium Communications Inc Common Stock,United States,,NASDAQ,IRDM
IRIX,IRIDEX Corporation Common Stock,United States,1996,NASDAQ,IRIX
IRMD,iRadimed Corporation Common Stock,United States,2014,NASDAQ,IRMD
IROQ,IF Bancorp Inc. Common Stock,United States,2011,NASDAQ,IROQ
IRTC,iRhythm Technologies Inc. Common Stock,United States,2016,NASDAQ,IRTC
IRWD,Ironwood Pharmaceuticals Inc. Class A Common Stock,United States,2010,NASDAQ,IRWD
ISAA,Iron Spark I Inc. Class A Common Stock,United States,2021,NASDAQ,ISAA
ISBC,Investors Bancorp Inc. Common Stock,United States,,NASDAQ,ISBC
ISEE,IVERIC bio Inc. Common Stock,United States,2013,NASDAQ,ISEE
ISIG,Insignia Systems Inc. Common Stock,United States,1991,NASDAQ,ISIG
ISLE,Isleworth Healthcare Acquisition Corporation Common stock,United States,2021,NASDAQ,ISLE
ISLEW,Isleworth Healthcare Acquisition Corporation Warrant,United States,2021,NASDAQ,ISLEW
ISNS,Image Sensing Systems Inc. Common Stock,United States,1995,NASDAQ,ISNS
ISPC,iSpecimen Inc. Common Stock,United States,2021,NASDAQ,ISPC
ISRG,Intuitive Surgical Inc. Common Stock,United States,2000,NASDAQ,ISRG
ISSC,Innovative Solutions and Support Inc. Common Stock,United States,2000,NASDAQ,ISSC
ISTR,Investar Holding Corporation Common Stock,United States,2014,NASDAQ,ISTR
ISUN,iSun Inc. Common Stock,United States,2016,NASDAQ,ISUN
ITAC,Industrial Tech Acquisitions Inc. Class A common stock,United States,2020,NASDAQ,ITAC
ITACU,Industrial Tech Acquisitions Inc. Unit,United States,2020,NASDAQ,ITACU
ITACW,Industrial Tech Acquisitions Inc. Warrant,United States,2020,NASDAQ,ITACW
ITCI,Intra-Cellular Therapies Inc. Common Stock,United States,,NASDAQ,ITCI
ITHX,ITHAX Acquisition Corp. Class A Ordinary Shares,United States,2021,NASDAQ,ITHX
ITHXU,ITHAX Acquisition Corp. Unit,United States,2021,NASDAQ,ITHXU
ITHXW,ITHAX Acquisition Corp. Warrant,United States,2021,NASDAQ,ITHXW
ITI,Iteris Inc. Common Stock,United States,,NASDAQ,ITI
ITIC,Investors Title Company Common Stock,United States,,NASDAQ,ITIC
ITMR,Itamar Medical Ltd. American Depository Shares,Israel,,NASDAQ,ITMR
ITOS,iTeos Therapeutics Inc. Common Stock,United States,2020,NASDAQ,ITOS
ITQ,Itiquira Acquisition Corp. Class A Ordinary Shares,United States,2021,NASDAQ,ITQ
ITQRU,Itiquira Acquisition Corp. Unit,United States,2021,NASDAQ,ITQRU
ITQRW,Itiquira Acquisition Corp. Warrant,United States,2021,NASDAQ,ITQRW
ITRI,Itron Inc. Common Stock,United States,1993,NASDAQ,ITRI
ITRM,Iterum Therapeutics plc Ordinary Share,Ireland,2018,NASDAQ,ITRM
ITRN,Ituran Location and Control Ltd. Ordinary Shares,Israel,2005,NASDAQ,ITRN
IVA,Inventiva S.A. American Depository Shares,France,2020,NASDAQ,IVA
IVAC,Intevac Inc. Common Stock,United States,1995,NASDAQ,IVAC
IZEA,IZEA Worldwide Inc. Common Stock,United States,,NASDAQ,IZEA
JACK,Jack In The Box Inc. Common Stock,United States,,NASDAQ,JACK
JAGX,Jaguar Health Inc. Common Stock,United States,2015,NASDAQ,JAGX
JAKK,JAKKS Pacific Inc. Common Stock,United States,1996,NASDAQ,JAKK
JAMF,Jamf Holding Corp. Common Stock,United States,2020,NASDAQ,JAMF
JAN,JanOne Inc. Common Stock (NV),United States,,NASDAQ,JAN
JANX,Janux Therapeutics Inc. Common Stock,United States,2021,NASDAQ,JANX
JAZZ,Jazz Pharmaceuticals plc Common Stock (Ireland),Ireland,2007,NASDAQ,JAZZ
JBHT,J.B. Hunt Transport Services Inc. Common Stock,United States,,NASDAQ,JBHT
JBLU,JetBlue Airways Corporation Common Stock,United States,2002,NASDAQ,JBLU
JBSS,John B. Sanfilippo & Son Inc. Common Stock,United States,1991,NASDAQ,JBSS
JCIC,Jack Creek Investment Corp. Class A Ordinary Shares,United States,2021,NASDAQ,JCIC
JCICU,Jack Creek Investment Corp. Units,United States,2021,NASDAQ,JCICU
JCICW,Jack Creek Investment Corp. Warrants,United States,2021,NASDAQ,JCICW
JCOM,j2 Global Inc. Common Stock,United States,1999,NASDAQ,JCOM
JCS,Communications Systems Inc. Common Stock,United States,,NASDAQ,JCS
JCTCF,Jewett-Cameron Trading Company Common Shares,United States,,NASDAQ,JCTCF
JD,JD.com Inc. American Depositary Shares,China,2014,NASDAQ,JD
JFIN,Jiayin Group Inc. American Depositary Shares,China,2019,NASDAQ,JFIN
JFU,9F Inc. American Depositary Shares,China,2019,NASDAQ,JFU
JG,Aurora Mobile Limited American Depositary Shares,China,2018,NASDAQ,JG
JJSF,J & J Snack Foods Corp. Common Stock,United States,1986,NASDAQ,JJSF
JKHY,Jack Henry & Associates Inc. Common Stock,United States,1985,NASDAQ,JKHY
JMPNL,JMP Group LLC 7.25% Senior Notes due 2027,United States,,NASDAQ,JMPNL
JMPNZ,JMP Group LLC 6.875% Senior Notes due 2029,United States,,NASDAQ,JMPNZ
JNCE,Jounce Therapeutics Inc. Common Stock,United States,2017,NASDAQ,JNCE
JOAN,JOANN Inc. Common Stock,United States,2021,NASDAQ,JOAN
JOBS,51job Inc. American Depositary Shares,China,2004,NASDAQ,JOBS
JOFF,JOFF Fintech Acquisition Corp. Class A Common Stock,United States,2021,NASDAQ,JOFF
JOFFU,JOFF Fintech Acquisition Corp. Unit,United States,2021,NASDAQ,JOFFU
JOFFW,JOFF Fintech Acquisition Corp. Warrant,United States,2021,NASDAQ,JOFFW
JOUT,Johnson Outdoors Inc. Class A Common Stock,United States,,NASDAQ,JOUT
JRJC,China Finance Online Co. Limited American Depositary Shares,China,2004,NASDAQ,JRJC
JRSH,Jerash Holdings (US) Inc. Common Stock,United States,2018,NASDAQ,JRSH
JRVR,James River Group Holdings Ltd. Common Shares,Bermuda,2014,NASDAQ,JRVR
JSM,Navient Corporation 6% Senior Notes due December 15 2043,United States,,NASDAQ,JSM
JUGGU,Jaws Juggernaut Acquisition Corporation Unit,United States,2021,NASDAQ,JUGGU
JUPW,Jupiter Wellness Inc. Common Stock,United States,2020,NASDAQ,JUPW
JUPWW,Jupiter Wellness Inc. Warrant,United States,2020,NASDAQ,JUPWW
JVA,Coffee Holding Co. Inc. Common Stock,United States,2005,NASDAQ,JVA
JWEL,Jowell Global Ltd. Ordinary Shares,China,2021,NASDAQ,JWEL
JYAC,Jiya Acquisition Corp. Class A Common Stock,United States,2020,NASDAQ,JYAC
JYNT,The Joint Corp. Common Stock,United States,2014,NASDAQ,JYNT
JZXN,Jiuzi Holdings Inc. Ordinary Shares,China,2021,NASDAQ,JZXN
KAII,Kismet Acquisition Two Corp. Class A Ordinary Shares,United States,2021,NASDAQ,KAII
KAIIU,Kismet Acquisition Two Corp. Unit,United States,2021,NASDAQ,KAIIU
KAIIW,Kismet Acquisition Two Corp. Warrant,United States,2021,NASDAQ,KAIIW
KAIR,Kairos Acquisition Corp. Class A Ordinary Shares,United States,2021,NASDAQ,KAIR
KAIRU,Kairos Acquisition Corp. Unit,United States,2021,NASDAQ,KAIRU
KAIRW,Kairos Acquisition Corp. Warrant,United States,2021,NASDAQ,KAIRW
KALA,Kala Pharmaceuticals Inc. Common Stock,United States,2017,NASDAQ,KALA
KALU,Kaiser Aluminum Corporation Common Stock,United States,,NASDAQ,KALU
KALV,KalVista Pharmaceuticals Inc. Common Stock,United Kingdom,2015,NASDAQ,KALV
KARO,Karooooo Ltd. Ordinary Shares,Singapore,2021,NASDAQ,KARO
KBAL,Kimball International Inc. Class B Common Stock,United States,,NASDAQ,KBAL
KBNT,Kubient Inc. Common Stock,United States,2020,NASDAQ,KBNT
KBNTW,Kubient Inc. Warrant,United States,2020,NASDAQ,KBNTW
KBSF,KBS Fashion Group Limited Common Stock,China,2013,NASDAQ,KBSF
KC,Kingsoft Cloud Holdings Limited American Depositary Shares,China,2020,NASDAQ,KC
KDMN,Kadmon Holdings Inc. Common Stock,United States,,NASDAQ,KDMN
KDNY,Chinook Therapeutics Inc. Common Stock,United States,2015,NASDAQ,KDNY
KDP,Keurig Dr Pepper Inc. Common Stock,United States,,NASDAQ,KDP
KE,Kimball Electronics Inc. Common Stock,United States,,NASDAQ,KE
KELYA,Kelly Services Inc. Class A Common Stock,United States,,NASDAQ,KELYA
KELYB,Kelly Services Inc. Class B Common Stock,United States,,NASDAQ,KELYB
KEQU,Kewaunee Scientific Corporation Common Stock,United States,,NASDAQ,KEQU
KERN,Akerna Corp. Common Stock,United States,2018,NASDAQ,KERN
KERNW,Akerna Corp Warrant,United States,2018,NASDAQ,KERNW
KFFB,Kentucky First Federal Bancorp Common Stock,United States,,NASDAQ,KFFB
KFRC,Kforce Inc. Common Stock,United States,1995,NASDAQ,KFRC
KHC,The Kraft Heinz Company Common Stock,United States,,NASDAQ,KHC
KIDS,OrthoPediatrics Corp. Common Stock,United States,2017,NASDAQ,KIDS
KIII,Kismet Acquisition Three Corp. Class A Ordinary Shares,United States,2021,NASDAQ,KIII
KIIIU,Kismet Acquisition Three Corp. Unit,United States,2021,NASDAQ,KIIIU
KIIIW,Kismet Acquisition Three Corp. Warrant,United States,2021,NASDAQ,KIIIW
KIN,Kindred Biosciences Inc. Common Stock,United States,2013,NASDAQ,KIN
KINS,Kingstone Companies Inc. Common Stock,United States,,NASDAQ,KINS
KINZ,KINS Technology Group Inc. Class A Common Stock,United States,2021,NASDAQ,KINZ
KINZU,KINS Technology Group Inc. Unit,United States,2020,NASDAQ,KINZU
KINZW,KINS Technology Group Inc. Warrant,United States,2021,NASDAQ,KINZW
KIRK,Kirkland's Inc. COMMONSTOCK,United States,2002,NASDAQ,KIRK
KLAC,KLA Corporation Common Stock,United States,1980,NASDAQ,KLAC
KLAQ,KL Acquisition Corp Class A Common Stock,United States,2021,NASDAQ,KLAQ
KLAQU,KL Acquisition Corp Unit,United States,2021,NASDAQ,KLAQU
KLAQW,KL Acquisition Corp Warrant,United States,2021,NASDAQ,KLAQW
KLDO,Kaleido Biosciences Inc. Common Stock,United States,2019,NASDAQ,KLDO
KLIC,Kulicke and Soffa Industries Inc. Common Stock,Singapore,,NASDAQ,KLIC
KLXE,KLX Energy Services Holdings Inc. Common Stock,United States,,NASDAQ,KLXE
KMDA,Kamada Ltd. Ordinary Shares,Israel,2013,NASDAQ,KMDA
KMPH,KemPharm Inc. Common Stock,United States,,NASDAQ,KMPH
KNBE,KnowBe4 Inc. Class A Common Stock,United States,2021,NASDAQ,KNBE
KNDI,Kandi Technologies Group Inc Common Stock,China,,NASDAQ,KNDI
KNSA,Kiniksa Pharmaceuticals Ltd. Class A Common Stock,United States,2018,NASDAQ,KNSA
KNSL,Kinsale Capital Group Inc. Common Stock,United States,2016,NASDAQ,KNSL
KNTE,Kinnate Biopharma Inc. Common Stock,United States,2020,NASDAQ,KNTE
KOD,Kodiak Sciences Inc Common Stock,United States,2018,NASDAQ,KOD
KOPN,Kopin Corporation Common Stock,United States,1992,NASDAQ,KOPN
KOR,Corvus Gold Inc. Common Shares,Canada,,NASDAQ,KOR
KOSS,Koss Corporation Common Stock,United States,,NASDAQ,KOSS
KPLT,Katapult Holdings Inc. Common Stock,United States,2019,NASDAQ,KPLT
KPLTW,Katapult Holdings Inc. Warrant,United States,2019,NASDAQ,KPLTW
KPTI,Karyopharm Therapeutics Inc. Common Stock,United States,2013,NASDAQ,KPTI
KRBP,Kiromic BioPharma Inc. Common Stock,United States,2020,NASDAQ,KRBP
KRKR,36Kr Holdings Inc. American Depositary Shares,China,2019,NASDAQ,KRKR
KRMD,Repro Med Systems Inc. Common Stock,United States,,NASDAQ,KRMD
KRNL,Kernel Group Holdings Inc. Class A Ordinary Shares,United States,2021,NASDAQ,KRNL
KRNLU,Kernel Group Holdings Inc. Units,United States,2021,NASDAQ,KRNLU
KRNLW,Kernel Group Holdings Inc. Warrants,United States,2021,NASDAQ,KRNLW
KRNT,Kornit Digital Ltd. Ordinary Shares,Israel,2015,NASDAQ,KRNT
KRNY,Kearny Financial Corp Common Stock,United States,,NASDAQ,KRNY
KRON,Kronos Bio Inc. Common Stock,United States,2020,NASDAQ,KRON
KROS,Keros Therapeutics Inc. Common Stock,United States,2020,NASDAQ,KROS
KRT,Karat Packaging Inc. Common Stock,United States,2021,NASDAQ,KRT
KRTX,Karuna Therapeutics Inc. Common Stock,United States,2019,NASDAQ,KRTX
KRUS,Kura Sushi USA Inc. Class A Common Stock,United States,2019,NASDAQ,KRUS
KRYS,Krystal Biotech Inc. Common Stock,United States,2017,NASDAQ,KRYS
KSI,Kadem Sustainable Impact Corporation Class A common stock,United States,2021,NASDAQ,KSI
KSICW,Kadem Sustainable Impact Corporation Warrant,United States,2021,NASDAQ,KSICW
KSMT,Kismet Acquisition One Corp Ordinary Shares,Russia,2020,NASDAQ,KSMT
KSMTU,Kismet Acquisition One Corp Unit,Russia,2020,NASDAQ,KSMTU
KSMTW,Kismet Acquisition One Corp Warrant,Russia,,NASDAQ,KSMTW
KSPN,Kaspien Holdings Inc. Common Stock,United States,,NASDAQ,KSPN
KTCC,Key Tronic Corporation Common Stock,United States,1983,NASDAQ,KTCC
KTOS,Kratos Defense & Security Solutions Inc. Common Stock,United States,,NASDAQ,KTOS
KTRA,Kintara Therapeutics Inc. Common Stock,United States,,NASDAQ,KTRA
KURA,Kura Oncology Inc. Common Stock,United States,,NASDAQ,KURA
KURI,Alkuri Global Acquisition Corp. Class A common stock,United States,2021,NASDAQ,KURI
KURIU,Alkuri Global Acquisition Corp. Unit,United States,2021,NASDAQ,KURIU
KURIW,Alkuri Global Acquisition Corp. Warrant,United States,2021,NASDAQ,KURIW
KVHI,KVH Industries Inc. Common Stock,United States,1996,NASDAQ,KVHI
KVSA,Khosla Ventures Acquisition Co. Class A Common Stock,United States,2021,NASDAQ,KVSA
KVSB,Khosla Ventures Acquisition Co. II Class A Common Stock,United States,2021,NASDAQ,KVSB
KVSC,Khosla Ventures Acquisition Co. III Class A Common Stock,United States,2021,NASDAQ,KVSC
KXIN,Kaixin Auto Holdings Ordinary Share,China,2017,NASDAQ,KXIN
KYMR,Kymera Therapeutics Inc. Common Stock,United States,2020,NASDAQ,KYMR
KZIA,Kazia Therapeutics Limited American Depositary Shares,Australia,,NASDAQ,KZIA
KZR,Kezar Life Sciences Inc. Common Stock,United States,2018,NASDAQ,KZR
LAAAU,Lakeshore Acquisition I Corp. Unit,China,2021,NASDAQ,LAAAU
LABP,Landos Biopharma Inc. Common Stock,United States,2021,NASDAQ,LABP
LAKE,Lakeland Industries Inc. Common Stock,United States,1986,NASDAQ,LAKE
LAMR,Lamar Advertising Company Class A Common Stock,United States,1996,NASDAQ,LAMR
LANC,Lancaster Colony Corporation Common Stock,United States,,NASDAQ,LANC
LAND,Gladstone Land Corporation Common Stock,United States,2013,NASDAQ,LAND
LANDM,Gladstone Land Corporation 5.00% Series D Cumulative Term Preferred Stock,United States,,NASDAQ,LANDM
LANDO,Gladstone Land Corporation 6.00% Series B Cumulative Redeemable Preferred Stock,United States,,NASDAQ,LANDO
LARK,Landmark Bancorp Inc. Common Stock,United States,,NASDAQ,LARK
LASR,nLIGHT Inc. Common Stock,United States,2018,NASDAQ,LASR
LATN,Union Acquisition Corp. II Ordinary Shares,United States,2019,NASDAQ,LATN
LATNW,Union Acquisition Corp. II Warrant,United States,2019,NASDAQ,LATNW
LAUR,Laureate Education Inc. Class A Common Stock,United States,2017,NASDAQ,LAUR
LAWS,Lawson Products Inc. Common Stock,United States,,NASDAQ,LAWS
LAZR,Luminar Technologies Inc.  Class A Common Stock,United States,2019,NASDAQ,LAZR
LAZY,Lazydays Holdings Inc. Common Stock,United States,,NASDAQ,LAZY
LBAI,Lakeland Bancorp Inc. Common Stock,United States,,NASDAQ,LBAI
LBC,Luther Burbank Corporation Common Stock,United States,2017,NASDAQ,LBC
LBPH,Longboard Pharmaceuticals Inc. Common Stock,United States,2021,NASDAQ,LBPH
LBPS,4D pharma plc American Depositary Shares,United Kingdom,,NASDAQ,LBPS
LBPSW,4D pharma plc Warrant,United Kingdom,,NASDAQ,LBPSW
LBRDA,Liberty Broadband Corporation Class A Common Stock,United States,,NASDAQ,LBRDA
LBRDK,Liberty Broadband Corporation Class C Common Stock,United States,,NASDAQ,LBRDK
LBRDP,Liberty Broadband Corporation Series A Cumulative Redeemable Preferred Stock,United States,,NASDAQ,LBRDP
LBTYA,Liberty Global plc Class A Ordinary Shares,United Kingdom,,NASDAQ,LBTYA
LBTYB,Liberty Global plc Class B Ordinary Shares,United Kingdom,,NASDAQ,LBTYB
LBTYK,Liberty Global plc Class C Ordinary Shares,United Kingdom,,NASDAQ,LBTYK
LCA,Landcadia Holdings IV Inc. Class A Common Stock,United States,2021,NASDAQ,LCA
LCAA,L Catterton Asia Acquisition Corp Class A Ordinary Shares,Singapore,2021,NASDAQ,LCAA
LCAAU,L Catterton Asia Acquisition Corp Units,Singapore,2021,NASDAQ,LCAAU
LCAAW,L Catterton Asia Acquisition Corp Warrant,Singapore,2021,NASDAQ,LCAAW
LCAHU,Landcadia Holdings IV Inc. Units,United States,2021,NASDAQ,LCAHU
LCAHW,Landcadia Holdings IV Inc. Warrant ,United States,2021,NASDAQ,LCAHW
LCAP,Lionheart Acquisition Corp. II Class A Common Stock,United States,2020,NASDAQ,LCAP
LCAPU,Lionheart Acquisition Corp. II Unit,United States,2020,NASDAQ,LCAPU
LCAPW,Lionheart Acquisition Corp. II Warrant,United States,2020,NASDAQ,LCAPW
LCNB,LCNB Corporation Common Stock,United States,,NASDAQ,LCNB
LCUT,Lifetime Brands Inc. Common Stock,United States,1991,NASDAQ,LCUT
LDHA,LDH Growth Corp I Class A Ordinary Shares,United States,2021,NASDAQ,LDHA
LDHAU,LDH Growth Corp I Units,United States,2021,NASDAQ,LDHAU
LDHAW,LDH Growth Corp I Warrant,United States,2021,NASDAQ,LDHAW
LE,Lands' End Inc. Common Stock,United States,,NASDAQ,LE
LECO,Lincoln Electric Holdings Inc. Common Shares,United States,,NASDAQ,LECO
LEDS,SemiLEDS Corporation Common Stock,Taiwan,2010,NASDAQ,LEDS
LEE,Lee Enterprises Incorporated Common Stock,United States,,NASDAQ,LEE
LEGA,Lead Edge Growth Opportunities Ltd Class A Ordinary Shares,United States,2021,NASDAQ,LEGA
LEGAU,Lead Edge Growth Opportunities Ltd Units,United States,2021,NASDAQ,LEGAU
LEGAW,Lead Edge Growth Opportunities Ltd Warrant,United States,2021,NASDAQ,LEGAW
LEGH,Legacy Housing Corporation Common Stock (TX),United States,2018,NASDAQ,LEGH
LEGN,Legend Biotech Corporation American Depositary Shares,United States,2020,NASDAQ,LEGN
LEGO,Legato Merger Corp. Common stock,United States,2021,NASDAQ,LEGO
LEGOU,Legato Merger Corp. Units,United States,2021,NASDAQ,LEGOU
LEGOW,Legato Merger Corp. Warrant,United States,2021,NASDAQ,LEGOW
LESL,Leslie's Inc. Common Stock,United States,2020,NASDAQ,LESL
LEVL,Level One Bancorp Inc. Common Stock,United States,2018,NASDAQ,LEVL
LEVLP,Level One Bancorp Inc. Depositary Shares Each Representing a 1/100th Interest in a Share of 7.50% Non-Cumulative Perpetual Preferred Stock Series B,United States,,NASDAQ,LEVLP
LEXX,Lexaria Bioscience Corp. Common Stock,Canada,,NASDAQ,LEXX
LEXXW,Lexaria Bioscience Corp. Warrant,Canada,,NASDAQ,LEXXW
LFMD,LifeMD Inc. Common Stock,United States,,NASDAQ,LFMD
LFST,LifeStance Health Group Inc. Common Stock,United States,2021,NASDAQ,LFST
LFTR,Lefteris Acquisition Corp. Class A Common Stock,United States,2020,NASDAQ,LFTR
LFTRU,Lefteris Acquisition Corp. Unit,United States,2020,NASDAQ,LFTRU
LFTRW,Lefteris Acquisition Corp. Warrant,United States,2020,NASDAQ,LFTRW
LFUS,Littelfuse Inc. Common Stock,United States,,NASDAQ,LFUS
LFVN,Lifevantage Corporation Common Stock (Delaware),United States,,NASDAQ,LFVN
LGAC,Lazard Growth Acquisition Corp. I Ordinary Shares,,2021,NASDAQ,LGAC
LGACU,Lazard Growth Acquisition Corp. I Units,,2021,NASDAQ,LGACU
LGACW,Lazard Growth Acquisition Corp. I Warrants,,2021,NASDAQ,LGACW
LGHL,Lion Group Holding Ltd. American Depositary Share,China,,NASDAQ,LGHL
LGHLW,Lion Group Holding Ltd. Warrant,China,,NASDAQ,LGHLW
LGIH,LGI Homes Inc. Common Stock,United States,2013,NASDAQ,LGIH
LGND,Ligand Pharmaceuticals Incorporated Common Stock,United States,,NASDAQ,LGND
LGO,Largo Resources Ltd. Common Shares,Canada,,NASDAQ,LGO
LGVN,Longeveron Inc. Class A Common Stock,United States,2021,NASDAQ,LGVN
LHAA,Lerer Hippeau Acquisition Corp. Class A Common Stock,United States,2021,NASDAQ,LHAA
LHCG,LHC Group Common Stock,United States,2005,NASDAQ,LHCG
LHDX,Lucira Health Inc. Common Stock,United States,2021,NASDAQ,LHDX
LI,Li Auto Inc. American Depositary Shares,China,2020,NASDAQ,LI
LIFE,aTyr Pharma Inc. Common Stock,United States,2015,NASDAQ,LIFE
LILA,Liberty Latin America Ltd. Class A Common Stock,United States,,NASDAQ,LILA
LILAK,Liberty Latin America Ltd. Class C Common Stock,United States,,NASDAQ,LILAK
LINC,Lincoln Educational Services Corporation Common Stock,United States,2005,NASDAQ,LINC
LIND,Lindblad Expeditions Holdings Inc. Common Stock,United States,2013,NASDAQ,LIND
LINK,Interlink Electronics Inc. Common Stock,United States,,NASDAQ,LINK
LIQT,LiqTech International Inc. Common Stock,Denmark,,NASDAQ,LIQT
LITE,Lumentum Holdings Inc. Common Stock,United States,,NASDAQ,LITE
LITTU,Logistics Innovation Technologies Corp. Units,United States,2021,NASDAQ,LITTU
LIVE,Live Ventures Incorporated Common Stock,United States,,NASDAQ,LIVE
LIVK,LIV Capital Acquisition Corp. Class A Ordinary Shares,Mexico,2020,NASDAQ,LIVK
LIVKW,LIV Capital Acquisition Corp. Warrant,Mexico,2020,NASDAQ,LIVKW
LIVN,LivaNova PLC Ordinary Shares,United Kingdom,,NASDAQ,LIVN
LIVX,LiveXLive Media Inc. Common Stock,United States,,NASDAQ,LIVX
LIXT,Lixte Biotechnology Holdings Inc. Common Stock,United States,,NASDAQ,LIXT
LIXTW,Lixte Biotechnology Holdings Inc. Warrants,United States,,NASDAQ,LIXTW
LIZI,LIZHI INC. American Depositary Shares,China,2020,NASDAQ,LIZI
LJAQ,LightJump Acquisition Corporation Common Stock,United States,2021,NASDAQ,LJAQ
LJAQU,LightJump Acquisition Corporation Unit,United States,2021,NASDAQ,LJAQU
LJAQW,LightJump Acquisition Corporation Warrant,United States,2021,NASDAQ,LJAQW
LJPC,La Jolla Pharmaceutical Company Common Stock,United States,1994,NASDAQ,LJPC
LKCO,Luokung Technology Corp Ordinary Shares,China,,NASDAQ,LKCO
LKFN,Lakeland Financial Corporation Common Stock,United States,,NASDAQ,LKFN
LKQ,LKQ Corporation Common Stock,United States,,NASDAQ,LKQ
LLNW,Limelight Networks Inc. Common Stock,United States,2007,NASDAQ,LLNW
LMACA,Liberty Media Acquisition Corporation Series A Common Stock,United States,2021,NASDAQ,LMACA
LMACU,Liberty Media Acquisition Corporation Unit,United States,2021,NASDAQ,LMACU
LMACW,Liberty Media Acquisition Corporation Warrants,United States,2021,NASDAQ,LMACW
LMAO,LMF Acquisition Opportunities Inc. Class A common stock,United States,2021,NASDAQ,LMAO
LMAOU,LMF Acquisition Opportunities Inc. Unit,United States,2021,NASDAQ,LMAOU
LMAOW,LMF Acquisition Opportunities Inc. Warrant,United States,2021,NASDAQ,LMAOW
LMAT,LeMaitre Vascular Inc. Common Stock,United States,2006,NASDAQ,LMAT
LMB,Limbach Holdings Inc. Common Stock,United States,,NASDAQ,LMB
LMFA,LM Funding America Inc. Common Stock,United States,2015,NASDAQ,LMFA
LMNL,Liminal BioSciences Inc. Common Shares,Canada,,NASDAQ,LMNL
LMNR,Limoneira Co Common Stock,United States,,NASDAQ,LMNR
LMPX,LMP Automotive Holdings Inc. Common Stock,United States,2019,NASDAQ,LMPX
LMRK,Landmark Infrastructure Partners LP Common Units,United States,2014,NASDAQ,LMRK
LMRKN,Landmark Infrastructure Partners LP 7% Series C Fltg/Fxd Perpetual Conv Preferred Stock,United States,,NASDAQ,LMRKN
LMRKO,Landmark Infrastructure Partners LP Perpetual Preferred Units Series B 7.90%,United States,,NASDAQ,LMRKO
LMRKP,Landmark Infrastructure Partners LP 8.00% Series A Cumulative Redeemable Perpetual Preferred Units,United States,,NASDAQ,LMRKP
LMST,Limestone Bancorp Inc. Common Stock,United States,,NASDAQ,LMST
LNDC,Landec Corporation Common Stock (DE),United States,1996,NASDAQ,LNDC
LNSR,LENSAR Inc. Common Stock,United States,,NASDAQ,LNSR
LNT,Alliant Energy Corporation Common Stock,United States,,NASDAQ,LNT
LNTH,Lantheus Holdings Inc. Common Stock,United States,2015,NASDAQ,LNTH
LOAN,Manhattan Bridge Capital Inc,United States,,NASDAQ,LOAN
LOB,Live Oak Bancshares Inc. Common Stock,United States,2015,NASDAQ,LOB
LOCO,El Pollo Loco Holdings Inc. Common Stock,United States,2014,NASDAQ,LOCO
LOGC,LogicBio Therapeutics Inc. Common Stock,United States,2018,NASDAQ,LOGC
LOGI,Logitech International S.A. Ordinary Shares,United States,1997,NASDAQ,LOGI
LOOP,Loop Industries Inc. Common Stock,Canada,,NASDAQ,LOOP
LOPE,Grand Canyon Education Inc. Common Stock,United States,2008,NASDAQ,LOPE
LORL,Loral Space and Communications Inc. Common Stock,United States,,NASDAQ,LORL
LOTZ,CarLotz Inc. Class A Common Stock,United States,2019,NASDAQ,LOTZ
LOTZW,CarLotz Inc. Warrant,United States,2019,NASDAQ,LOTZW
LOVE,The Lovesac Company Common Stock,United States,2018,NASDAQ,LOVE
LPCN,Lipocine Inc. Common Stock,United States,,NASDAQ,LPCN
LPLA,LPL Financial Holdings Inc. Common Stock,United States,2010,NASDAQ,LPLA
LPRO,Open Lending Corporation Class A Common Stock,United States,,NASDAQ,LPRO
LPSN,LivePerson Inc. Common Stock,United States,2000,NASDAQ,LPSN
LPTH,LightPath Technologies Inc. Class A Common Stock,United States,1996,NASDAQ,LPTH
LPTX,Leap Therapeutics Inc. Common Stock,United States,,NASDAQ,LPTX
LQDA,Liquidia Corporation Common Stock,United States,2018,NASDAQ,LQDA
LQDT,Liquidity Services Inc. Common Stock,United States,2006,NASDAQ,LQDT
LRCX,Lam Research Corporation Common Stock,United States,1984,NASDAQ,LRCX
LRFC,Logan Ridge Finance Corporation Common Stock,United States,2013,NASDAQ,LRFC
LRMR,Larimar Therapeutics Inc. Common Stock,United States,2014,NASDAQ,LRMR
LSAQ,LifeSci Acquisition II Corp. Common Stock,United States,2020,NASDAQ,LSAQ
LSBK,Lake Shore Bancorp Inc. Common Stock,United States,,NASDAQ,LSBK
LSCC,Lattice Semiconductor Corporation Common Stock,United States,,NASDAQ,LSCC
LSEA,Landsea Homes Corporation Common Stock,United States,2018,NASDAQ,LSEA
LSEAW,Landsea Homes Corporation Warrant,United States,2018,NASDAQ,LSEAW
LSTR,Landstar System Inc. Common Stock,United States,1993,NASDAQ,LSTR
LSXMA,Liberty Media Corporation Series A Liberty SiriusXM Common Stock,United States,,NASDAQ,LSXMA
LSXMB,Liberty Media Corporation Series B Liberty SiriusXM Common Stock,United States,,NASDAQ,LSXMB
LSXMK,Liberty Media Corporation Series C Liberty SiriusXM Common Stock,United States,,NASDAQ,LSXMK
LTBR,Lightbridge Corporation Common Stock,United States,,NASDAQ,LTBR
LTCH,Latch Inc. Common Stock,United States,2020,NASDAQ,LTCH
LTCHW,Latch Inc. Warrant expiring 6/4/2026,United States,2020,NASDAQ,LTCHW
LTRN,Lantern Pharma Inc. Common Stock,United States,2020,NASDAQ,LTRN
LTRPA,Liberty TripAdvisor Holdings Inc. Series A Common Stock,United States,,NASDAQ,LTRPA
LTRPB,Liberty TripAdvisor Holdings Inc. Series B Common Stock,United States,,NASDAQ,LTRPB
LTRX,Lantronix Inc. Common Stock,United States,2000,NASDAQ,LTRX
