Symbol,Name,Country,IPO Year,Exchange,Cleaned Symbol
PFSI,PennyMac Financial Services Inc. Common Stock,United States,2013,NYSE,PFSI
PG,Procter & Gamble Company (The) Common Stock,United States,,NYSE,PG
PGP,Pimco Global Stocksplus & Income Fund Pimco Global StocksPlus & Income Fund Common Shares of Beneficial Interest,United States,2005,NYSE,PGP
PGR,Progressive Corporation (The) Common Stock,United States,,NYSE,PGR
PGRE,Paramount Group Inc. Common Stock,United States,2014,NYSE,PGRE
PGTI,PGT Innovations Inc.,United States,2006,NYSE,PGTI
PGZ,Principal Real Estate Income Fund Common Shares of Beneficial Interest,,2013,NYSE,PGZ
PH,Parker-Hannifin Corporation Common Stock,United States,,NYSE,PH
PHD,Pioneer Floating Rate Fund Inc.,United States,2004,NYSE,PHD
PHG,Koninklijke Philips N.V. NY Registry Shares,Netherlands,,NYSE,PHG
PHI,PLDT Inc. Sponsored ADR,Philippines,,NYSE,PHI
PHK,Pimco High Income Fund Pimco High Income Fund,United States,2003,NYSE,PHK
PHM,PulteGroup Inc. Common Stock,United States,,NYSE,PHM
PHR,Phreesia Inc. Common Stock,United States,2019,NYSE,PHR
PHT,Pioneer High Income Fund Inc.,United States,,NYSE,PHT
PHX,PHX Minerals Inc. Common Stock,United States,,NYSE,PHX
PIAI,Prime Impact Acquisition I Class A Ordinary Shares,,2020,NYSE,PIAI
PII,Polaris Inc. Common Stock,United States,,NYSE,PII
PIM,Putnam Master Intermediate Income Trust Common Stock,United States,1988,NYSE,PIM
PINE,Alpine Income Property Trust Inc. Common Stock,United States,2019,NYSE,PINE
PING,Ping Identity Holding Corp. Common Stock,United States,2019,NYSE,PING
PINS,Pinterest Inc. Class A Common Stock,,2019,NYSE,PINS
PIPP,Pine Island Acquisition Corp. Class A Common Stock,United States,2021,NYSE,PIPP
PIPR,Piper Sandler Companies Common Stock,United States,,NYSE,PIPR
PJT,PJT Partners Inc. Class A Common Stock,United States,2015,NYSE,PJT
PK,Park Hotels & Resorts Inc. Common Stock ,United States,2016,NYSE,PK
PKE,Park Aerospace Corp. Common Stock,United States,,NYSE,PKE
PKG,Packaging Corporation of America Common Stock,United States,2000,NYSE,PKG
PKI,PerkinElmer Inc. Common Stock,United States,,NYSE,PKI
PKO,Pimco Income Opportunity Fund Common Shares of Beneficial Interest,United States,,NYSE,PKO
PKX,POSCO Common Stock,South Korea,1994,NYSE,PKX
PLAN,Anaplan Inc. Common Stock,United States,2018,NYSE,PLAN
PLD,Prologis Inc. Common Stock,United States,,NYSE,PLD
PLNT,Planet Fitness Inc. Common Stock,United States,2015,NYSE,PLNT
PLOW,Douglas Dynamics Inc. Common Stock,United States,2010,NYSE,PLOW
PLTR,Palantir Technologies Inc. Class A Common Stock,,2020,NYSE,PLTR
PLYM,Plymouth Industrial REIT Inc. Common Stock,United States,2017,NYSE,PLYM
PM,Philip Morris International Inc Common Stock,United States,,NYSE,PM
PMF,PIMCO Municipal Income Fund Common Stock,United States,2001,NYSE,PMF
PML,Pimco Municipal Income Fund II Common Shares of Beneficial Interest,United States,2002,NYSE,PML
PMM,Putnam Managed Municipal Income Trust Common Stock,United States,1989,NYSE,PMM
PMO,Putnam Municipal Opportunities Trust Common Stock,United States,1993,NYSE,PMO
PMT,PennyMac Mortgage Investment Trust Common Shares of Beneficial Interest,United States,2009,NYSE,PMT
PMT^A,PennyMac Mortgage Investment Trust 8.125% Series A Fixed-to-Floating Rate Cumulative Redeemable Preferred Shares of Beneficial Interest,United States,,NYSE,PMT.A
PMT^B,PennyMac Mortgage Investment Trust 8.00% Series B Fixed-to-Floating Rate Cumulative Redeemable Preferred Shares of Beneficial Interest,United States,,NYSE,PMT.B
PMVC,PMV Consumer Acquisition Corp. Class A Common Stock,United States,2020,NYSE,PMVC
PMX,PIMCO Municipal Income Fund III Common Shares of Beneficial Interest,United States,2002,NYSE,PMX
PNC,PNC Financial Services Group Inc. (The) Common Stock,United States,,NYSE,PNC
PNC^P,PNC Financial Services Group Inc. (The) Depositary Shares Representing 1/4000th Perpetual Preferred Series P,United States,,NYSE,PNC.P
PNF,PIMCO New York Municipal Income Fund Common Stock,United States,2001,NYSE,PNF
PNI,Pimco New York Municipal Income Fund II Common Shares of Beneficial Interest,United States,2002,NYSE,PNI
PNM,PNM Resources Inc. (Holding Co.) Common Stock,United States,,NYSE,PNM
PNR,Pentair plc. Ordinary Share,Switzerland,,NYSE,PNR
PNTM,Pontem Corporation Class A Ordinary Shares,,2021,NYSE,PNTM
PNW,Pinnacle West Capital Corporation Common Stock,United States,,NYSE,PNW
POLY,Plantronics Inc. Common Stock,United States,,NYSE,POLY
POND,Angel Pond Holdings Corporation Class A Ordinary Shares,,2021,NYSE,POND
POR,Portland General Electric Co Common Stock,United States,,NYSE,POR
POST,Post Holdings Inc. Common Stock,United States,2012,NYSE,POST
PPG,PPG Industries Inc. Common Stock,United States,,NYSE,PPG
PPL,PPL Corporation Common Stock,United States,,NYSE,PPL
PPT,Putnam Premier Income Trust Common Stock,United States,1988,NYSE,PPT
PQG,PQ Group Holdings Inc. Common Stock,United States,2017,NYSE,PQG
PRA,ProAssurance Corporation Common Stock,United States,,NYSE,PRA
PRE^J,PartnerRe Ltd. 4.875% Fixed Rate Non-Cumulative Redeemable Preferred Shares Series J,Bermuda,,NYSE,PRE.J
PRG,PROG Holdings Inc. Common Stock,United States,,NYSE,PRG
PRGO,Perrigo Company plc Ordinary Shares,United States,,NYSE,PRGO
PRI,Primerica Inc. Common Stock,United States,2010,NYSE,PRI
PRIF^A,Priority Income Fund Inc. 6.375% Series A Term Preferred Stock due 2025,,,NYSE,PRIF.A
PRIF^D,Priority Income Fund Inc. 7.00% Series D Term Preferred Stock due 2029,,,NYSE,PRIF.D
PRIF^E,Priority Income Fund Inc. 6.375% Series E Preferred Stock Due 2024,,,NYSE,PRIF.E
PRIF^F,Priority Income Fund Inc. 6.625% Series F Term Preferred Stock due 2027,,,NYSE,PRIF.F
PRIF^G,Priority Income Fund Inc. 6.25% Series G Preferred Stock Due 2026,,,NYSE,PRIF.G
PRIF^H,Priority Income Fund Inc. 6.00% Series H Term Preferred Stock due 2026,,,NYSE,PRIF.H
PRIF^I,Priority Income Fund Inc. 6.125% Series I Term Preferred Stock due 2028,,,NYSE,PRIF.I
PRLB,Proto Labs Inc. Common stock,United States,2012,NYSE,PRLB
PRMW,Primo Water Corporation Common Stock,Canada,,NYSE,PRMW
PRO,PROS Holdings Inc. Common Stock,United States,2007,NYSE,PRO
PROS,ProSight Global Inc. Common Stock,United States,2019,NYSE,PROS
PRPB,CC Neuberger Principal Holdings II Class A Ordinary Shares,United States,2020,NYSE,PRPB
PRPC,CC Neuberger Principal Holdings III Class A Ordinary Shares,,2021,NYSE,PRPC
PRS,Prudential Financial Inc. 5.625% Junior Subordinated Notes due 2058,United States,2018,NYSE,PRS
PRT,PermRock Royalty Trust Trust Units,United States,2018,NYSE,PRT
PRTY,Party City Holdco Inc. Common Stock,United States,2015,NYSE,PRTY
PRU,Prudential Financial Inc. Common Stock,United States,2001,NYSE,PRU
PSA,Public Storage Common Stock,United States,,NYSE,PSA
PSA^E,Public Storage Depositary Shares Each Representing 1/1000 of a 4.90% Cumulative Preferred Share of Beneficial Interest Series E,United States,,NYSE,PSA.E
PSA^F,Public Storage Depositary Shares Each Representing 1/1000 of a 5.15% Cumulative Preferred Share of Beneficial Interest Series F par value $0.01 per share,United States,,NYSE,PSA.F
PSA^G,Public Storage Depositary Shares Each Representing 1/1000 of a 5.05% Cumulative Preferred Share of Beneficial Interest Series G,United States,,NYSE,PSA.G
PSA^H,Public Storage Depositary Shares Each Representing 1/1000 of a  5.60% Cumulative Preferred  Share of Beneficial Interest Series H,United States,,NYSE,PSA.H
PSA^I,Public Storage Depositary Shares Each Representing 1/1000 of a 4.875% Cumulative Preferred Share of Beneficial Interest Series I par value $0.01 per share,United States,,NYSE,PSA.I
PSA^J,Public Storage Depositary Shares Each Representing 1/1000 of a 4.700% Cumulative Preferred Share of Beneficial Interest Series J par value $0.01 per share,United States,,NYSE,PSA.J
PSA^K,Public Storage Depositary Shares Each Representing 1/1000 of a 4.75% Cumulative Preferred Share of Beneficial Interest Series K,United States,,NYSE,PSA.K
PSA^L,Public Storage Depositary Shares Each Representing 1/1000 of a 4.625% Cumulative Preferred Share of Beneficial Interest Series L par value $0.01 per share,United States,,NYSE,PSA.L
PSA^M,Public Storage Depositary Shares Each Representing 1/1000 of a 4.125% Cumulative Preferred Share of Beneficial Interest Series M,United States,,NYSE,PSA.M
PSA^N,Public Storage Depositary Shares Each Representing 1/1000 of a 3.875% Cumulative Preferred Share of Beneficial Interest Series N,United States,,NYSE,PSA.N
PSA^O,Public Storage Depositary Shares Each Representing 1/1000 of a 3.900% Cumulative Preferred Share of Beneficial Interest Series O,United States,,NYSE,PSA.O
PSA^P,Public Storage Depositary Shares Each Representing 1/1000 of a 4.000% Cumulative Preferred Share of Bene cial Interest Series P,United States,,NYSE,PSA.P
PSB,PS Business Parks Inc. (MD) Common Stock,United States,,NYSE,PSB
PSB^W,PS Business Parks Inc. Depositary Shares Each Representing 1/1000 of a Share of 5.20% Cumulative Preferred Stock Series W,United States,,NYSE,PSB.W
PSB^X,PS Business Parks Inc. Depositary Shares Each Representing 1/1000 of a Share of 5.25% Cumulative Preferred Stock Series X,United States,,NYSE,PSB.X
PSB^Y,PS Business Parks Inc. 5.20% Cumulative Preferred Stock Series Y,United States,,NYSE,PSB.Y
PSB^Z,PS Business Parks Inc. Depositary Shares Each Representing 1/1000 of a Share of 4.875% Cumulative Preferred Stock Series Z  par value $0.01 per share,United States,,NYSE,PSB.Z
PSF,Cohen & Steers Select Preferred and Income Fund Inc. Common Stock,,2010,NYSE,PSF
PSFE,Paysafe Limited Common Shares,,2021,NYSE,PSFE
PSN,Parsons Corporation Common Stock,,2019,NYSE,PSN
PSO,Pearson Plc Common Stock,United Kingdom,,NYSE,PSO
PSPC,Post Holdings Partnering Corporation Series A Common Stock,,2021,NYSE,PSPC
PSTG,Pure Storage Inc. Class A Common Stock,,2015,NYSE,PSTG
PSTH,Pershing Square Tontine Holdings Ltd. Class A Common Stock,,2020,NYSE,PSTH
PSTL,Postal Realty Trust Inc. Class A Common Stock,,2019,NYSE,PSTL
PSX,Phillips 66 Common Stock,United States,,NYSE,PSX
PSXP,Phillips 66 Partners LP Common Units representing limited partner interest in the Partnership,United States,2013,NYSE,PSXP
PTA,Cohen & Steers Tax-Advantaged Preferred Securities and Income Fund Common Shares of Beneficial Interest,,2020,NYSE,PTA
PTR,PetroChina Company Limited Common Stock,China,,NYSE,PTR
PTY,Pimco Corporate & Income Opportunity Fund,United States,2002,NYSE,PTY
PUK,Prudential Public Limited Company Common Stock,United Kingdom,,NYSE,PUK
PUK^,Prudential Public Limited Company 6.75% Perpetual Subordinated Captial Security,United Kingdom,,NYSE,PUK.
PUK^A,Prudential Public Limited Company 6.50% Perpetual Subordinated Capital Securities Exchangeable at the Issuer's Option Into Non-Cumulative Dollar Denominated Preference Shares,United Kingdom,,NYSE,PUK.A
PUMP,ProPetro Holding Corp. Common Stock,United States,2017,NYSE,PUMP
PV,Primavera Capital Acquisition Corporation Class A Ordinary Shares,,2021,NYSE,PV
PVG,Pretium Resources Inc. Ordinary Shares (Canada),Canada,,NYSE,PVG
PVH,PVH Corp. Common Stock,United States,,NYSE,PVH
PVL,Permianville Royalty Trust Trust Units ,United States,2011,NYSE,PVL
PWR,Quanta Services Inc. Common Stock,United States,,NYSE,PWR
PXD,Pioneer Natural Resources Company Common Stock,United States,,NYSE,PXD
PYN,PIMCO New York Municipal Income Fund III Common Shares of Beneficial Interest,United States,2002,NYSE,PYN
PYS,Merrill Lynch Depositor Inc PPlus Tr Ser RRD-1 Tr Ctf Cl A,United States,,NYSE,PYS
PZC,PIMCO California Municipal Income Fund III Common Shares of Beneficial Interest,United States,2002,NYSE,PZC
PZN,Pzena Investment Management Inc Class A Common Stock,United States,2007,NYSE,PZN
QD,Qudian Inc. American Depositary Shares each representing one Class A Ordinary Share,China,2017,NYSE,QD
QFTA,Quantum FinTech Acquisition Corporation Common Stock,,2021,NYSE,QFTA
QGEN,Qiagen N.V. Common Shares ,Netherlands,,NYSE,QGEN
QS,QuantumScape Corporation Class A Common Stock,United States,2020,NYSE,QS
QSR,Restaurant Brands International Inc. Common Shares,Canada,2014,NYSE,QSR
QTS,QTS Realty Trust Inc. Class A Common Stock,United States,2013,NYSE,QTS
QTS^A,QTS Realty Trust Inc. 7.125% Series A Cumulative Redeemable Perpetual Preferred Stock,United States,,NYSE,QTS.A
QTS^B,QTS Realty Trust Inc. 6.50% Series B Cumulative Convertible Perpetual Preferred Stock,United States,,NYSE,QTS.B
QTWO,Q2 Holdings Inc. Common Stock,,2014,NYSE,QTWO
QUAD,Quad Graphics Inc Class A Common Stock,United States,,NYSE,QUAD
QUOT,Quotient Technology Inc. Common Stock,,2014,NYSE,QUOT
QVCC,QVC Inc. 6.250% Senior Secured Notes due 2068,United States,2019,NYSE,QVCC
QVCD,QVC Inc. 6.375% Senior Secured Notes due 2067,United States,2018,NYSE,QVCD
R,Ryder System Inc. Common Stock,United States,,NYSE,R
RA,Brookfield Real Assets Income Fund Inc. Common Stock,,2016,NYSE,RA
RAAS,Cloopen Group Holding Limited American Depositary Shares each representing two Class A Ordinary Shares,,2021,NYSE,RAAS
RACE,Ferrari N.V. Common Shares,,2015,NYSE,RACE
RAD,Rite Aid Corporation Common Stock,United States,,NYSE,RAD
RAMP,LiveRamp Holdings Inc. Common Stock,United States,2018,NYSE,RAMP
RBA,Ritchie Bros. Auctioneers Incorporated Common Stock,Canada,,NYSE,RBA
RBAC,RedBall Acquisition Corp. Class A Ordinary Shares,United States,2020,NYSE,RBAC
RBC,Regal Beloit Corporation Common Stock,United States,,NYSE,RBC
RBLX,Roblox Corporation Class A Common Stock,,2021,NYSE,RBLX
RC,Ready Capital Corproation Common Stock,United States,2013,NYSE,RC
RC^C,Ready Capital Corporation 6.25% Series C Cumulative Convertible Preferred Stock,United States,,NYSE,RC.C
RC^E,Ready Capital Corporation 6.50% Series E Cumulative Redeemable Preferred Stock,United States,,NYSE,RC.E
RCA,Ready Capital Corporation 7.00% Convertible Senior Notes due 2023,United States,2017,NYSE,RCA
RCB,Ready Capital Corporation 6.20% Senior Notes due 2026,United States,2019,NYSE,RCB
RCC,Ready Capital Corporation 5.75% Senior Notes due 2026,United States,2021,NYSE,RCC
RCI,Rogers Communication Inc. Common Stock,Canada,,NYSE,RCI
RCL,D/B/A Royal Caribbean Cruises Ltd. Common Stock,United States,1993,NYSE,RCL
RCS,PIMCO Strategic Income Fund Inc.,United States,1994,NYSE,RCS
RCUS,Arcus Biosciences Inc. Common Stock,,2018,NYSE,RCUS
RDN,Radian Group Inc. Common Stock,United States,,NYSE,RDN
RDS/B,Royal Dutch Shell PLC,Netherlands,,NYSE,RDS/B
RDY,Dr. Reddy's Laboratories Ltd Common Stock,India,,NYSE,RDY
RE,Everest Re Group Ltd. Common Stock,Bermuda,,NYSE,RE
RELX,RELX PLC PLC American Depositary Shares (Each representing One Ordinary Share),United Kingdom,2015,NYSE,RELX
RENN,Renren Inc. American Depositary Shares each representing fifteen Class A ordinary shares,China,2011,NYSE,RENN
RERE,AiHuiShou International Co. Ltd. American Depositary Shares (every three of which representing two Class A ordinary shares),,2021,NYSE,RERE
RES,RPC Inc. Common Stock,United States,,NYSE,RES
REV,Revlon Inc. New Common Stock,United States,1996,NYSE,REV
REVG,REV Group Inc. Common Stock,United States,2017,NYSE,REVG
REX,REX American Resources Corporation,United States,,NYSE,REX
REXR,Rexford Industrial Realty Inc. Common Stock,United States,2013,NYSE,REXR
REXR^A,Rexford Industrial Realty Inc. 5.875% Series A Cumulative Redeemable Preferred Stock,United States,,NYSE,REXR.A
REXR^B,Rexford Industrial Realty Inc. 5.875% Series B Cumulative Redeemable Preferred Stock,United States,,NYSE,REXR.B
REXR^C,Rexford Industrial Realty Inc. 5.625% Series C Cumulative Redeemable Preferred Stock par value $0.01 per share,United States,,NYSE,REXR.C
REZI,Resideo Technologies Inc. Common Stock ,,2018,NYSE,REZI
RF,Regions Financial Corporation Common Stock,United States,,NYSE,RF
RF^B,Regions Financial Corporation Depositary Shares Representing 1/40th Perpetual Preferred Series B,United States,,NYSE,RF.B
RF^C,Regions Financial Corporation Depositary Shares each Representing a 1/40th Interest in a  Share of 5.700% Fixed-to-Floating Rate Non-Cumulative  Perpetual Preferred Stock Series C,United States,,NYSE,RF.C
RF^E,Regions Financial Corporation Depositary Shares Each Representing a 1/40th Interest in a Share of 4.45% Non-Cumulative Perpetual Preferred Stock Series E,United States,,NYSE,RF.E
RFI,Cohen & Steers Total Return Realty Fund Inc. Common Stock,United States,1993,NYSE,RFI
RFL,Rafael Holdings Inc. Class B Common Stock,United States,2018,NYSE,RFL
RFM,RiverNorth Flexible Municipal Income Fund Inc. Common Stock,,2020,NYSE,RFM
RFMZ,RiverNorth Flexible Municipal Income Fund II Inc. Common Stock,,2021,NYSE,RFMZ
RFP,Resolute Forest Products Inc. Common Stock,Canada,,NYSE,RFP
RGA,Reinsurance Group of America Incorporated Common Stock,United States,,NYSE,RGA
RGR,Sturm Ruger & Company Inc. Common Stock,United States,,NYSE,RGR
RGS,Regis Corporation Common Stock,United States,1991,NYSE,RGS
RGT,Royce Global Value Trust Inc. Common Stock,,2013,NYSE,RGT
RH,RH Common Stock,United States,2012,NYSE,RH
RHI,Robert Half International Inc. Common Stock,United States,,NYSE,RHI
RHP,Ryman Hospitality Properties Inc. (REIT),United States,,NYSE,RHP
RICE,Rice Acquisition Corp. Class A Common Stock,United States,2020,NYSE,RICE
RIG,Transocean Ltd (Switzerland) Common Stock,Switzerland,,NYSE,RIG
RIO,Rio Tinto Plc Common Stock,Australia,2002,NYSE,RIO
RIV,RiverNorth Opportunities Fund Inc. Common Stock,,2015,NYSE,RIV
RJF,Raymond James Financial Inc. Common Stock,United States,,NYSE,RJF
RKT,Rocket Companies Inc. Class A Common Stock,United States,2020,NYSE,RKT
RKTA,Rocket Internet Growth Opportunities Corp. Class A Ordinary Shares,,2021,NYSE,RKTA
RL,Ralph Lauren Corporation Common Stock,United States,1997,NYSE,RL
RLGY,Realogy Holdings Corp. Common Stock,United States,2012,NYSE,RLGY
RLI,RLI Corp. Common Stock (DE),United States,,NYSE,RLI
RLJ,RLJ Lodging Trust Common Shares of Beneficial Interest $0.01 par value,United States,2011,NYSE,RLJ
RLJ^A,RLJ Lodging Trust $1.95 Series A Cumulative Convertible  Preferred Shares,United States,,NYSE,RLJ.A
RLX,RLX Technology Inc. American Depositary Shares each representing the right to receive one (1) Class A ordinary share,,2021,NYSE,RLX
RM,Regional Management Corp. Common Stock,United States,2012,NYSE,RM
RMAX,RE/MAX Holdings Inc. Class A Common Stock,,2013,NYSE,RMAX
RMD,ResMed Inc. Common Stock,United States,,NYSE,RMD
RMI,RiverNorth Opportunistic Municipal Income Fund Inc. Common Stock,,2018,NYSE,RMI
RMM,RiverNorth Managed Duration Municipal Income Fund Inc. Common Stock,,2019,NYSE,RMM
RMO,Romeo Power Inc. Class A Common Stock,,2019,NYSE,RMO
RMPL^,RiverNorth Specialty Finance Corporation 5.875% ,,,NYSE,RMPL.
RMT,Royce Micro-Cap Trust Inc. Common Stock,United States,,NYSE,RMT
RNG,RingCentral Inc. Class A Common Stock,,2013,NYSE,RNG
RNGR,Ranger Energy Services Inc. Class A Common Stock,United States,2017,NYSE,RNGR
RNP,Cohen & Steers REIT and Preferred and Income Fund Inc. Common Shares,United States,2003,NYSE,RNP
RNR,RenaissanceRe Holdings Ltd. Common Stock,Bermuda,,NYSE,RNR
RNR^E,RenaissanceRe Holdings Ltd. 5.375% Series E Preference Shares,Bermuda,,NYSE,RNR.E
RNR^F,RenaissanceRe Holdings Ltd. Depositary Shares each Representing a 1/1000th Interest in a 5.750% Series F Preference Share,Bermuda,,NYSE,RNR.F
RNR^G,RenaissanceRe Holdings Ltd. Depositary Shares each representing a 1/1000th interest in a share of 4.20% Series G Preference Shares,Bermuda,,NYSE,RNR.G
ROG,Rogers Corporation Common Stock,United States,,NYSE,ROG
ROK,Rockwell Automation Inc. Common Stock,United States,,NYSE,ROK
ROL,Rollins Inc. Common Stock,United States,,NYSE,ROL
ROP,Roper Technologies Inc. Common Stock,United States,1992,NYSE,ROP
ROSS,Ross Acquisition Corp II Class A Ordinary Shares,,2021,NYSE,ROSS
ROT,Rotor Acquisition Corp. Class A Common Stock,,2021,NYSE,ROT
RPAI,Retail Properties of America Inc. Class A Common Stock,United States,2012,NYSE,RPAI
RPM,RPM International Inc. Common Stock,United States,,NYSE,RPM
RPT,RPT Realty Common Stock,United States,,NYSE,RPT
RPT^D,RPT Realty 7.25% ,United States,,NYSE,RPT.D
RQI,Cohen & Steers Quality Income Realty Fund Inc Common Shares,United States,2002,NYSE,RQI
RRC,Range Resources Corporation Common Stock,United States,,NYSE,RRC
RRD,R.R. Donnelley & Sons Company Common Stock,United States,,NYSE,RRD
RS,Reliance Steel & Aluminum Co. Common Stock (DE),United States,1994,NYSE,RS
RSF,RiverNorth Specialty Finance Corporation,,2019,NYSE,RSF
RSG,Republic Services Inc. Common Stock,United States,1998,NYSE,RSG
RSI,Rush Street Interactive Inc. Class A Common Stock,,2020,NYSE,RSI
RTP,Reinvent Technology Partners Class A Ordinary Shares,United States,2020,NYSE,RTP
RTPZ,Reinvent Technology Partners Z Class A Ordinary Shares,United States,2021,NYSE,RTPZ
RTX,Raytheon Technologies Corporation Common Stock,United States,,NYSE,RTX
RVI,Retail Value Inc. Common Stock ,United States,2018,NYSE,RVI
RVLV,Revolve Group Inc. Class A Common Stock,,2019,NYSE,RVLV
RVT,Royce Value Trust Inc. Common Stock,United States,1986,NYSE,RVT
RWT,Redwood Trust Inc. Common Stock,United States,1995,NYSE,RWT
RXN,Rexnord Corporation Common Stock,United States,2012,NYSE,RXN
RY,Royal Bank Of Canada Common Stock,Canada,,NYSE,RY
RY^T,Royal Bank Of Canada 6.750% Fixed Rate/Floating Rate Noncumulative First Preferred Shares Series C-2,Canada,,NYSE,RY.T
RYAM,Rayonier Advanced Materials Inc. Common Stock,United States,2014,NYSE,RYAM
RYB,RYB Education Inc. American depositary shares each representing one Class A ordinary share,,2017,NYSE,RYB
RYI,Ryerson Holding Corporation Common Stock,United States,2014,NYSE,RYI
RYN,Rayonier Inc. REIT Common Stock,United States,,NYSE,RYN
RZA,Reinsurance Group of America Incorporated 6.20% Fixed-to-Floating Rate Subordinated Debentures due 2042,United States,,NYSE,RZA
RZB,Reinsurance Group of America Incorporated 5.75% Fixed-To-Floating Rate Subordinated Debentures due 2056,United States,2016,NYSE,RZB
S,SentinelOne Inc. Class A Common Stock,,2021,NYSE,S
SA,Seabridge Gold Inc. Ordinary Shares (Canada),Canada,,NYSE,SA
SAF,Saratoga Investment Corp 6.25% Notes due 2023,United States,2018,NYSE,SAF
SAFE,Safehold Inc. Common Stock,United States,2017,NYSE,SAFE
SAH,Sonic Automotive Inc. Common Stock,United States,1997,NYSE,SAH
SAIC,SCIENCE APPLICATIONS INTERNATIONAL CORPORATION Common Stock,,,NYSE,SAIC
SAIL,SailPoint Technologies Holdings Inc. Common Stock,United States,2017,NYSE,SAIL
SAK,Saratoga Investment Corp 7.25% Notes due 2025,United States,2020,NYSE,SAK
SAM,Boston Beer Company Inc. (The) Common Stock,United States,,NYSE,SAM
SAN,Banco Santander S.A. Sponsored ADR (Spain),Spain,,NYSE,SAN
SAND          ,Sandstorm Gold Ltd. Ordinary Shares (Canada),Canada,,NYSE,SAND          
SAP,SAP  SE ADS,Germany,,NYSE,SAP
SAR,Saratoga Investment Corp New,United States,,NYSE,SAR
SAVE,Spirit Airlines Inc. Common Stock,United States,,NYSE,SAVE
SB,Safe Bulkers Inc Common Stock ($0.001 par value),Monaco,2008,NYSE,SB
SB^C,Safe Bulkers Inc Cumulative Redeemable Perpetual Preferred Series C (Marshall Islands),Monaco,,NYSE,SB.C
SB^D,Safe Bulkers Inc Perpetual Preferred Series D (Marshall Islands),Monaco,,NYSE,SB.D
SBBA,Scorpio Tankers Inc. 7.00% Senior Notes due 2025,Monaco,2020,NYSE,SBBA
SBH,Sally Beauty Holdings Inc. (Name to be changed from Sally Holdings Inc.) Common Stock,United States,,NYSE,SBH
SBI,Western Asset Intermediate Muni Fund Inc Common Stock,United States,1992,NYSE,SBI
SBII,Sandbridge X2 Corp. Class A Common Stock,,2021,NYSE,SBII
SBOW,SilverBow Resorces Inc. Common Stock,,,NYSE,SBOW
SBR,Sabine Royalty Trust Common Stock,United States,,NYSE,SBR
SBS,Companhia de saneamento Basico Do Estado De Sao Paulo - Sabesp American Depositary Shares (Each repstg 250 Common Shares),Brazil,2002,NYSE,SBS
SBSW,D/B/A Sibanye-Stillwater Limited ADS,,,NYSE,SBSW
SC,Santander Consumer USA Holdings Inc. Common Stock,,2014,NYSE,SC
SCCO,Southern Copper Corporation Common Stock,United States,,NYSE,SCCO
SCD,LMP Capital and Income Fund Inc. Common Stock,United States,2004,NYSE,SCD
SCE^G,SCE Trust II Trust Preferred Securities,United States,,NYSE,SCE.G
SCE^H,SCE Trust III Fixed/Floating Rate Trust Preference Securities,United States,,NYSE,SCE.H
SCE^J,Southern California Edison Company 5.375% Fixed-to-Floating Rate Trust Preference Securities,United States,,NYSE,SCE.J
SCE^K,Southern California Edison Company 5.45% Fixed-to-Floating Rate Trust Preference Securities,United States,,NYSE,SCE.K
SCE^L,SCE TRUST VI,United States,,NYSE,SCE.L
SCHW,Charles Schwab Corporation (The) Common Stock,United States,,NYSE,SCHW
SCHW^D,The Charles Schwab Corporation Depositary Shares each representing 1/40th interest in a share of 5.95% Non-Cumulative Perpetual Preferred Stock Series D,United States,,NYSE,SCHW.D
SCHW^J,The Charles Schwab Corporation Depositary Shares Each Representing a 1/40th Interest in a Share of 4.450% Non-Cumulative Perpetual Preferred Stock Series J,United States,,NYSE,SCHW.J
SCI,Service Corporation International Common Stock,United States,,NYSE,SCI
SCL,Stepan Company Common Stock,United States,,NYSE,SCL
SCM,Stellus Capital Investment Corporation Common Stock,United States,2012,NYSE,SCM
SCPE,SC Health Corporation Class A Ordinary Shares,,2019,NYSE,SCPE
SCS,Steelcase Inc. Common Stock,United States,1998,NYSE,SCS
SCU,Sculptor Capital Management Inc. Class A Common Stock,United States,,NYSE,SCU
SCVX,SCVX Corp. Class A Ordinary Shares,,2020,NYSE,SCVX
SCX,L.S. Starrett Company (The) Common Stock,United States,,NYSE,SCX
SD,SandRidge Energy Inc. Common Stock,,2016,NYSE,SD
SDHY,PGIM Short Duration High Yield Opportunities Fund Common Shares,,2020,NYSE,SDHY
SE,Sea Limited American Depositary Shares each representing one Class A Ordinary Share,United States,2017,NYSE,SE
SEAH,Sports Entertainment Acquisition Corp. Class A Common Stock,United States,2020,NYSE,SEAH
SEAS,SeaWorld Entertainment Inc. Common Stock,United States,2013,NYSE,SEAS
SEE,Sealed Air Corporation Common Stock,United States,,NYSE,SEE
SEM,Select Medical Holdings Corporation Common Stock,United States,2009,NYSE,SEM
SEMR,SEMrush Holdings Inc. Class A Common Stock,,2021,NYSE,SEMR
