Symbol,Name,Country,IPO Year,Exchange,Cleaned Symbol
GGZ,Gabelli Global Small and Mid Cap Value Trust (The) Common Shares of Beneficial Interest,,2014,NYSE,GGZ
GGZ^A,Gabelli Global Small and Mid Cap Value Trust (The) 5.450% Series A Cumulative Preferred Shares (Liquidation Preference $25.00 per share),,,NYSE,GGZ.A
GHC,Graham Holdings Company Common Stock,United States,,NYSE,GHC
GHG,GreenTree Hospitality Group Ltd. American depositary shares each representing one Class A ordinary share,,2018,NYSE,GHG
GHL,Greenhill & Co. Inc. Common Stock,United States,2004,NYSE,GHL
GHLD,Guild Holdings Company Class A Common Stock,,2020,NYSE,GHLD
GHM,Graham Corporation Common Stock,United States,,NYSE,GHM
GHY,PGIM Global High Yield Fund Inc.,United States,2012,NYSE,GHY
GIB,CGI Inc. Common Stock,Canada,,NYSE,GIB
GIC,Global Industrial Company Common Stock,United States,,NYSE,GIC
GIL,Gildan Activewear Inc. Class A Sub. Vot. Common Stock,Canada,1998,NYSE,GIL
GIM,Templeton Global Income Fund Inc. Common Stock,United States,1988,NYSE,GIM
GIS,General Mills Inc. Common Stock,United States,,NYSE,GIS
GJH,Synthetic Fixed-Income Securities Inc 6.375% (STRATS) Cl A-1,United States,,NYSE,GJH
GJO,Synthetic Fixed-Income Securities Inc. Synthetic Fixed-Income Securities Inc. on behalf of STRATS(SM) Trust for Wal-Mart Stores Inc. Securities Series 2004-5,United States,,NYSE,GJO
GJP,Synthetic Fixed-Income Securities Inc. Synthetic Fixed-Income Securities Inc. on behalf of STRATS (SM) Trust for Dominion Resources Inc. Securities Series 2005-6 Floating Rate Structured Repackaged Asset-Backed Trust Securities (STRATS) Certificates,United States,,NYSE,GJP
GJR,Synthetic Fixed-Income Securities Inc. STRATS Trust for Procter&Gamble Securities Series 2006-1,United States,,NYSE,GJR
GJS,Goldman Sachs Group Securities STRATS Trust for Goldman Sachs Group Securities Series 2006-2,United States,,NYSE,GJS
GJT,Synthetic Fixed-Income Securities Inc. Synthetic Fixed-Income Securities Inc. Floating Rate Structured Repackaged Asset-Backed Trust Securities Certificates Series 2006-3,United States,,NYSE,GJT
GKOS,Glaukos Corporation Common Stock,United States,2015,NYSE,GKOS
GL,Globe Life Inc. Common Stock,United States,,NYSE,GL
GL^D,Globe Life Inc. 4.25% Junior Subordinated Debentures due 2061,United States,,NYSE,GL.D
GLEO,Galileo Acquisition Corp. Ordinary Shares,,2019,NYSE,GLEO
GLOB,Globant S.A. Common Shares,,2014,NYSE,GLOB
GLOG^A,GasLog LP. 8.75% Series A Cumulative Redeemable Perpetual Preference Shares,Monaco,,NYSE,GLOG.A
GLOP,GasLog Partners LP Common Units representing limited partnership interests,,2014,NYSE,GLOP
GLOP^A,GasLog Partners LP 8.625% Series A Cumulative Redeemable Perpetual Fixed to Floating Rate Preference Units,,,NYSE,GLOP.A
GLOP^B,GasLog Partners LP 8.200% Series B Cumulative Redeemable Perpetual Fixed to Floating Rate Preference Units,,,NYSE,GLOP.B
GLOP^C,GasLog Partners LP 8.500% Series C Cumulative Redeemable Perpetual Fixed to Floating Rate Preference Units,,,NYSE,GLOP.C
GLP,Global Partners LP Global Partners LP Common Units representing Limited Partner Interests,United States,2005,NYSE,GLP
GLP^A,Global Partners LP 9.75% Series A Fixed-to-Floating Rate Cumulative Redeemable Perpetual Preferred Units representing limited partner interests,United States,,NYSE,GLP.A
GLP^B,Global Partners LP 9.50% Series B Fixed Rate Cumulative Redeemable Perpetual Preferred Units representing limited partner interests,United States,,NYSE,GLP.B
GLT,Glatfelter Corporation Common Stock,United States,,NYSE,GLT
GLW,Corning Incorporated Common Stock,United States,,NYSE,GLW
GM,General Motors Company Common Stock,United States,2010,NYSE,GM
GME,GameStop Corporation Common Stock,United States,2002,NYSE,GME
GMED,Globus Medical Inc. Class A Common Stock,United States,2012,NYSE,GMED
GMRE,Global Medical REIT Inc. Common Stock,,2016,NYSE,GMRE
GMRE^A,Global Medical REIT Inc. Series A Cumulative Redeemable Preferred Stock,,,NYSE,GMRE.A
GMS,GMS Inc. Common Stock,United States,2016,NYSE,GMS
GNE,Genie Energy Ltd. Class B Common Stock Stock,United States,2011,NYSE,GNE
GNE^A,Genie Energy Ltd. Series 2012 - A Preferred Stock $0.01 par value,United States,,NYSE,GNE.A
GNK,Genco Shipping & Trading Limited Ordinary Shares New (Marshall Islands),United States,,NYSE,GNK
GNL,Global Net Lease Inc. Common Stock,United States,2015,NYSE,GNL
GNL^A,Global Net Lease Inc. 7.25% Series A Cumulative Redeemable Preferred Stock $0.01 par value per share,United States,,NYSE,GNL.A
GNL^B,Global Net Lease Inc. 6.875% Series B Cumulative Redeemable Perpetual Preferred Stock,United States,,NYSE,GNL.B
GNPK,Genesis Park Acquisition Corp. Class A Ordinary Shares,United States,2021,NYSE,GNPK
GNRC,Generac Holdlings Inc. Common Stock,United States,2010,NYSE,GNRC
GNT,GAMCO Natural Resources Gold & Income Trust,United States,2011,NYSE,GNT
GNT^A,GAMCO Natural Resources Gold & Income Tust  5.20% Series A Cumulative Preferred Shares (Liquidation Preference $25.00 per share),United States,,NYSE,GNT.A
GNW,Genworth Financial Inc Common Stock,United States,2004,NYSE,GNW
GOAC,GO Acquisition Corp. Class A Common Stock,,2020,NYSE,GOAC
GOF,Guggenheim Strategic Opportunities Fund Common Shares of Beneficial Interest,United States,,NYSE,GOF
GOL,Gol Linhas Aereas Inteligentes S.A. Sponsored ADR representing 2 Pfd Shares,Brazil,2004,NYSE,GOL
GOLD,Barrick Gold Corporation Common Stock (BC),Canada,,NYSE,GOLD
GOLF,Acushnet Holdings Corp. Common Stock,United States,2016,NYSE,GOLF
GOOS,Canada Goose Holdings Inc. Subordinate Voting Shares,,2017,NYSE,GOOS
GOTU,Gaotu Techedu Inc. American Depositary Shares,,2019,NYSE,GOTU
GPC,Genuine Parts Company Common Stock,United States,,NYSE,GPC
GPI,Group 1 Automotive Inc. Common Stock,United States,1997,NYSE,GPI
GPJA,Georgia Power Company Series 2017A 5.00% Junior Subordinated Notes due October 1 2077,United States,2017,NYSE,GPJA
GPK,Graphic Packaging Holding Company,United States,,NYSE,GPK
GPM,Guggenheim Enhanced Equity Income Fund,,,NYSE,GPM
GPMT,Granite Point Mortgage Trust Inc. Common Stock,,2017,NYSE,GPMT
GPN,Global Payments Inc. Common Stock,United States,,NYSE,GPN
GPOR,Gulfport Energy Corporation Common Shares,United States,2021,NYSE,GPOR
GPRK,Geopark Ltd Common Shares,Bermuda,2014,NYSE,GPRK
GPS,Gap Inc. (The) Common Stock,United States,,NYSE,GPS
GPX,GP Strategies Corporation Common Stock,United States,,NYSE,GPX
GRA,W.R. Grace & Co. Common Stock,United States,,NYSE,GRA
GRC,Gorman-Rupp Company (The) Common Stock,United States,,NYSE,GRC
GRX,The Gabelli Healthcare & Wellness Trust Common Shares of Beneficial Interest,United States,,NYSE,GRX
GS,Goldman Sachs Group Inc. (The) Common Stock,United States,1999,NYSE,GS
GS^A,Goldman Sachs Group Inc. (The) Depositary Shares each representing 1/1000th Interest in a Share of Floating Rate Non-Cumulative Preferred Stock Series A,United States,,NYSE,GS.A
GS^C,Goldman Sachs Group Inc. (The) Depositary Share repstg 1/1000th Preferred Series C,United States,,NYSE,GS.C
GS^D,Goldman Sachs Group Inc. (The) Dep Shs repstg 1/1000 Pfd Ser D Fltg,United States,,NYSE,GS.D
GS^J,Goldman Sachs Group Inc Depositary Shs Repstg 1/1000th Pfd Ser J Fixed to Fltg Rate,United States,,NYSE,GS.J
GS^K,Goldman Sachs Group Inc. (The) Dep Shs Repstg 1/1000 Int Sh Fxd/Fltg Non Cum Pfd Stk Ser K,United States,,NYSE,GS.K
GSAH,GS Acquisition Holdings Corp II Class A Common Stock,United States,2020,NYSE,GSAH
GSBD,Goldman Sachs BDC Inc. Common Stock,United States,2015,NYSE,GSBD
GSK,GlaxoSmithKline PLC Common Stock,United Kingdom,,NYSE,GSK
GSL,Global Ship Lease Inc New Class A Common Shares,United Kingdom,,NYSE,GSL
GSL^B,Global Ship Lease Inc. Depository Shares Representing 1/100th Perpetual Preferred Series B% (Marshall Island),United Kingdom,,NYSE,GSL.B
GSLD,Global Ship Lease Inc. 8.00% Senior Notes due 2024,United Kingdom,2019,NYSE,GSLD
GSQD,G Squared Ascend I Inc. Class A Ordinary Shares,,2021,NYSE,GSQD
GTES,Gates Industrial Corporation plc Ordinary Shares,,2018,NYSE,GTES
GTLS,Chart Industries Inc. Common Stock,United States,2006,NYSE,GTLS
GTN,Gray Television Inc. Common Stock,United States,,NYSE,GTN
GTS,Triple-S Management Corporation Common Stock,United States,2007,NYSE,GTS
GTY,Getty Realty Corporation Common Stock,United States,,NYSE,GTY
GUT,Gabelli Utility Trust (The) Common Stock,United States,,NYSE,GUT
GUT^A,Gabelli Utility Trust (The) 5.625% Series A Cumulative Preferred Shares,United States,,NYSE,GUT.A
GUT^C,Gabelli Utility Trust (The) 5.375% Series C Cumulative Preferred Shares,United States,,NYSE,GUT.C
GVA,Granite Construction Incorporated Common Stock,United States,,NYSE,GVA
GWB,Great Western Bancorp Inc. Common Stock,United States,2014,NYSE,GWB
GWRE,Guidewire Software Inc. Common Stock,United States,2012,NYSE,GWRE
GWW,W.W. Grainger Inc. Common Stock,United States,,NYSE,GWW
H,Hyatt Hotels Corporation Class A Common Stock,United States,2009,NYSE,H
HAE,Haemonetics Corporation Common Stock,United States,1991,NYSE,HAE
HAL,Halliburton Company Common Stock,United States,,NYSE,HAL
HASI,Hannon Armstrong Sustainable Infrastructure Capital Inc. Common Stock,United States,2013,NYSE,HASI
HAYW,Hayward Holdings Inc. Common Stock,,2021,NYSE,HAYW
HBB,Hamilton Beach Brands Holding Company Class A Common Stock ,,2017,NYSE,HBB
HBI,Hanesbrands Inc. Common Stock,United States,,NYSE,HBI
HBM,Hudbay Minerals Inc. Ordinary Shares (Canada),Canada,,NYSE,HBM
HCA,HCA Healthcare Inc. Common Stock,United States,2011,NYSE,HCA
HCC,Warrior Met Coal Inc. Common Stock,United States,2017,NYSE,HCC
HCHC,HC2 Holdings Inc. Common Stock,United States,,NYSE,HCHC
HCI,HCI Group Inc. Common Stock,United States,,NYSE,HCI
HCXY,Hercules Capital Inc. 6.25% Notes due 2033,United States,2018,NYSE,HCXY
HD,Home Depot Inc. (The) Common Stock,United States,,NYSE,HD
HDB,HDFC Bank Limited Common Stock,India,2001,NYSE,HDB
HE,Hawaiian Electric Industries Inc. Common Stock,United States,,NYSE,HE
HEI,Heico Corporation Common Stock,United States,,NYSE,HEI
HEI/A,Heico Corporation,United States,,NYSE,HEI/A
HEP,Holly Energy Partners L.P. Common Stock,United States,2004,NYSE,HEP
HEQ,John Hancock Hedged Equity & Income Fund Common Shares of Beneficial Interest,United States,2011,NYSE,HEQ
HES,Hess Corporation Common Stock,United States,,NYSE,HES
HESM,Hess Midstream LP Class A Share,United States,2017,NYSE,HESM
HEXO,HEXO Corp. Common Shares,,,NYSE,HEXO
HFC,HollyFrontier Corporation Common Stock,United States,,NYSE,HFC
HFRO,Highland Income Fund,,2017,NYSE,HFRO
HFRO^A,Highland Income Fund 5.375% Series A Cumulative Preferred Shares,,,NYSE,HFRO.A
HGH,Hartford Financial Services Group Inc. (The) 7.875% Fixed to Floating Rate Junior Subordinated Debentures due 2042,United States,,NYSE,HGH
HGLB,Highland Global Allocation Fund Common Stock,,2019,NYSE,HGLB
HGV,Hilton Grand Vacations Inc. Common Stock ,,2016,NYSE,HGV
HHC,Howard Hughes Corporation (The) Common Stock,United States,,NYSE,HHC
HHLA,HH&L Acquisition Co. Class A Ordinary Shares,,2021,NYSE,HHLA
HI,Hillenbrand Inc Common Stock,United States,,NYSE,HI
HIE,Miller/Howard High Income Equity Fund Common Shares of Beneficial Interest,United States,2014,NYSE,HIE
HIG,Hartford Financial Services Group Inc. (The) Common Stock,United States,,NYSE,HIG
HIG^G,Hartford Financial Services Group Inc. (The) Depositary Shares each representing a 1/1000th interest in a share of 6.000% Non-Cumulative Preferred Stock Series G $0.01 par value,United States,,NYSE,HIG.G
HIGA,H.I.G. Acquisition Corp. Class A Ordinary Shares,United States,2020,NYSE,HIGA
HII,Huntington Ingalls Industries Inc. Common Stock,United States,,NYSE,HII
HIL,Hill International Inc. Common Stock,United States,2018,NYSE,HIL
HIMS,Hims & Hers Health Inc. Class A Common Stock,,2019,NYSE,HIMS
HIO,Western Asset High Income Opportunity Fund Inc. Common Stock,United States,,NYSE,HIO
HIW,Highwoods Properties Inc. Common Stock,United States,1994,NYSE,HIW
HIX,Western Asset High Income Fund II Inc. Common Stock,United States,1998,NYSE,HIX
HKIB,AMTD International Inc. American Depositary Shares each representing one Class A Ordinary Share,,2019,NYSE,HKIB
HL,Hecla Mining Company Common Stock,United States,,NYSE,HL
HL^B,Hecla Mining Company Preferred Stock,United States,,NYSE,HL.B
HLF,Herbalife Nutrition Ltd. Common Stock,Cayman Islands,2004,NYSE,HLF
HLI,Houlihan Lokey Inc. Class A Common Stock,United States,2015,NYSE,HLI
HLLY,Holley Inc. Common Stock,United States,2020,NYSE,HLLY
HLT,Hilton Worldwide Holdings Inc. Common Stock ,,2016,NYSE,HLT
HLX,Helix Energy Solutions Group Inc. Common Stock,United States,,NYSE,HLX
HMC,Honda Motor Company Ltd. Common Stock,Japan,,NYSE,HMC
HMLP,Hoegh LNG Partners LP Common Units representing Limited Partner Interests,Bermuda,2014,NYSE,HMLP
HMLP^A,Hoegh LNG Partners LP 8.75% Series A Cumulative Redeemable Preferred Units,Bermuda,,NYSE,HMLP.A
HMN,Horace Mann Educators Corporation Common Stock,United States,1991,NYSE,HMN
HMY,Harmony Gold Mining Company Limited,South Africa,,NYSE,HMY
HNGR,Hanger Inc. Common Stock,United States,2018,NYSE,HNGR
HNI,HNI Corporation Common Stock,United States,,NYSE,HNI
HNP,Huaneng Power Intl Common Stock,China,1994,NYSE,HNP
HOG,Harley-Davidson Inc. Common Stock,United States,,NYSE,HOG
HOME,At Home Group Inc. Common Stock,United States,2016,NYSE,HOME
HOV,Hovnanian Enterprises Inc. Class A Common Stock,United States,,NYSE,HOV
HP,Helmerich & Payne Inc. Common Stock,United States,,NYSE,HP
HPE,Hewlett Packard Enterprise Company Common Stock,United States,2015,NYSE,HPE
HPF,John Hancock Pfd Income Fund II Pfd Income Fund II,United States,2002,NYSE,HPF
HPI,John Hancock Preferred Income Fund Common Shares of Beneficial Interest,United States,2002,NYSE,HPI
HPP,Hudson Pacific Properties Inc. Common Stock,United States,2010,NYSE,HPP
HPQ,HP Inc. Common Stock,United States,,NYSE,HPQ
HPS,John Hancock Preferred Income Fund III Preferred Income Fund III,United States,2003,NYSE,HPS
HPX,HPX Corp. Class A Ordinary Shares,United States,2020,NYSE,HPX
HQH,Tekla Healthcare Investors Common Stock,United States,1987,NYSE,HQH
HQL,TeklaLife Sciences Investors Common Stock,United States,1992,NYSE,HQL
HR,Healthcare Realty Trust Incorporated Common Stock,United States,1993,NYSE,HR
HRB,H&R Block Inc. Common Stock,United States,,NYSE,HRB
HRC,Hill-Rom Holdings Inc Common Stock,United States,,NYSE,HRC
HRI,Herc Holdings Inc. Common Stock ,,2016,NYSE,HRI
HRL,Hormel Foods Corporation Common Stock,United States,,NYSE,HRL
HRTG,Heritage Insurance Holdings Inc. Common Stock,,2014,NYSE,HRTG
HSBC,HSBC Holdings plc. Common Stock,United Kingdom,,NYSE,HSBC
HSC,Harsco Corporation Common Stock,United States,,NYSE,HSC
HSY,The Hershey Company Common Stock,United States,,NYSE,HSY
HT,Hersha Hospitality Trust Class A Common Shares of Beneficial Interest,United States,1999,NYSE,HT
HT^C,Hersha Hospitality Trust 6.875% Series C Cumulative Redeemable Preferred Shares of Beneficial Interest,United States,,NYSE,HT.C
HT^D,Hersha Hospitality Trust 6.50% Series D Cumulative Redeemable Preferred Shares of Beneficial Interest $0.01 par value per share,United States,,NYSE,HT.D
HT^E,Hersha Hospitality Trust 6.50% Series E Cumulative Redeemable Preferred Shares of Beneficial Interest,United States,,NYSE,HT.E
HTA,Healthcare Trust of America Inc. Class A Common Stock,United States,,NYSE,HTA
HTD,John Hancock Tax Advantaged Dividend Income Fund Common Shares of Beneficial Interest,United States,2004,NYSE,HTD
HTGC,Hercules Capital Inc. Common Stock,United States,2012,NYSE,HTGC
HTH,Hilltop Holdings Inc.,United States,,NYSE,HTH
HTPA,Highland Transcend Partners I Corp. Class A Ordinary Shares,,2021,NYSE,HTPA
HTY,John Hancock Tax-Advantaged Global Shareholder Yield Fund Common Shares of Beneficial Interest,United States,,NYSE,HTY
HUBB,Hubbell Inc Common Stock,United States,2015,NYSE,HUBB
HUBS,HubSpot Inc. Common Stock,United States,2014,NYSE,HUBS
HUGS,USHG Acquisition Corp. Class A Common Stock,,2021,NYSE,HUGS
HUM,Humana Inc. Common Stock,United States,,NYSE,HUM
HUN,Huntsman Corporation Common Stock,United States,2005,NYSE,HUN
HUYA,HUYA Inc. American depositary shares each  representing one Class A ordinary share,United States,2018,NYSE,HUYA
HVT,Haverty Furniture Companies Inc. Common Stock,United States,,NYSE,HVT
HVT/A,Haverty Furniture Companies Inc.,United States,,NYSE,HVT/A
HWM,Howmet Aerospace Inc. Common Stock,United States,,NYSE,HWM
HXL,Hexcel Corporation Common Stock,United States,,NYSE,HXL
HY,Hyster-Yale Materials Handling Inc. Class A Common Stock,United States,,NYSE,HY
HYB,New America High Income Fund Inc. (The) Common Stock,United States,1988,NYSE,HYB
HYI,Western Asset High Yield Defined Opportunity Fund Inc. Common Stock,,2010,NYSE,HYI
HYLN,Hyliion Holdings Corp. Class A Common Stock,,2019,NYSE,HYLN
HYT,Blackrock Corporate High Yield Fund Inc. Common Stock,United States,2003,NYSE,HYT
HZAC,Horizon Acquisition Corporation Class A Ordinary Shares,United States,2020,NYSE,HZAC
HZN,Horizon Global Corporation Common Shares,United States,2015,NYSE,HZN
HZO,MarineMax Inc.  (FL) Common Stock,United States,1998,NYSE,HZO
HZON,Horizon Acquisition Corporation II Class A Ordinary Shares,United States,2020,NYSE,HZON
IAA,IAA Inc. Common Stock ,,2019,NYSE,IAA
IACB,ION Acquisition Corp 2 Ltd. Class A Ordinary Shares,,2021,NYSE,IACB
IACC,ION Acquisition Corp 3 Ltd. Class A Ordinary Shares,,2021,NYSE,IACC
IAE,Voya Asia Pacific High Dividend Equity Income Fund ING Asia Pacific High Dividend Equity Income Fund Common Shares of Beneficial Interest,United States,2007,NYSE,IAE
IAG,Iamgold Corporation Ordinary Shares,Canada,,NYSE,IAG
IBA,Industrias Bachoco S.A.B. de C.V. Common Stock,Mexico,1997,NYSE,IBA
IBER,Ibere Pharmaceuticals Class A Ordinary Shares,,2021,NYSE,IBER
IBM,International Business Machines Corporation Common Stock,United States,,NYSE,IBM
IBN,ICICI Bank Limited Common Stock,India,,NYSE,IBN
IBP,Installed Building Products Inc. Common Stock,,2014,NYSE,IBP
ICD,Independence Contract Drilling Inc. Common Stock,,2014,NYSE,ICD
ICE,Intercontinental Exchange Inc. Common Stock,United States,2005,NYSE,ICE
ICL,ICL Group Ltd. Ordinary Shares,Israel,2014,NYSE,ICL
IDA,IDACORP Inc. Common Stock,United States,,NYSE,IDA
IDE,Voya Infrastructure Industrials and Materials Fund Common Shares of Beneficial Interest,United States,2010,NYSE,IDE
IDT,IDT Corporation Class B Common Stock,United States,,NYSE,IDT
IEX,IDEX Corporation Common Stock,United States,1989,NYSE,IEX
IFF,Internationa Flavors & Fragrances Inc. Common Stock,United States,,NYSE,IFF
IFFT,International Flavors & Fragrances Inc. 6.00% Tangible Equity Units,United States,2018,NYSE,IFFT
IFN,India Fund Inc. (The) Common Stock,United States,,NYSE,IFN
IFS,Intercorp Financial Services Inc. Common Shares,,2019,NYSE,IFS
IGA,Voya Global Advantage and Premium Opportunity Fund Common Shares of Beneficial Interest,United States,2005,NYSE,IGA
IGD,Voya Global Equity Dividend and Premium Opportunity Fund,United States,2005,NYSE,IGD
IGI,Western Asset Investment Grade Defined Opportunity Trust Inc. Common Stock,United States,2009,NYSE,IGI
IGR,CBRE Clarion Global Real Estate Income Fund Common Stock,United States,2004,NYSE,IGR
IGT,International Game Technology Ordinary Shares,United States,2015,NYSE,IGT
IH,iHuman Inc. American depositary shares each representing five Class A ordinary shares,United States,2020,NYSE,IH
IHC,Independence Holding Company Common Stock,United States,,NYSE,IHC
IHD,Voya Emerging Markets High Income Dividend Equity Fund Common Shares,United States,2011,NYSE,IHD
IHG,Intercontinental Hotels Group American Depositary Shares (Each representing one Ordinary Share),United Kingdom,,NYSE,IHG
IHIT,Invesco High Income 2023 Target Term Fund Common Shares of Beneficial Interest,United States,2016,NYSE,IHIT
IHTA,Invesco High Income 2024 Target Term Fund Common Shares of Beneficial Interest No par value per share,,2017,NYSE,IHTA
IIAC,Investindustrial Acquisition Corp. Class A Ordinary Shares,United Kingdom,2021,NYSE,IIAC
IIF,Morgan Stanley India Investment Fund Inc. Common Stock,United States,1994,NYSE,IIF
IIIN,Insteel Industries Inc. Common Stock,United States,,NYSE,IIIN
IIM,Invesco Value Municipal Income Trust Common Stock,United States,,NYSE,IIM
IIPR,Innovative Industrial Properties Inc. Common Stock,United States,2016,NYSE,IIPR
IIPR^A,Innovative Industrial Properties Inc. 9.00% Series A Cumulative Redeemable Preferred Stock,United States,,NYSE,IIPR.A
IMAX,Imax Corporation Common Stock,Canada,,NYSE,IMAX
IMPX,AEA-Bridges Impact Corp. Class A Ordinary Shares,,2020,NYSE,IMPX
INFO,IHS Markit Ltd. Common Shares,Bermuda,1996,NYSE,INFO
INFY,Infosys Limited American Depositary Shares,India,,NYSE,INFY
ING,ING Group N.V. Common Stock,Netherlands,1997,NYSE,ING
INGR,Ingredion Incorporated Common Stock,United States,,NYSE,INGR
INN,Summit Hotel Properties Inc. Common Stock,United States,2011,NYSE,INN
INN^D,Summit Hotel Properties Inc. 6.45% Series D Cumulative Redeemable Preferred Stock,United States,,NYSE,INN.D
INN^E,Summit Hotel Properties Inc. 6.250% Series E Cumulative Redeemable Preferred Stock,United States,,NYSE,INN.E
INS,Intelligent Systems Corporation Common Stock,United States,1992,NYSE,INS
INSI,Insight Select Income Fund,United States,,NYSE,INSI
INSP,Inspire Medical Systems Inc. Common Stock,United States,1998,NYSE,INSP
INSW,International Seaways Inc. Common Stock ,,2016,NYSE,INSW
INSW^A,International Seaways Inc. 8.50% Senior Notes due June 30 2023,,,NYSE,INSW.A
INT,World Fuel Services Corporation Common Stock,United States,,NYSE,INT
INVH,Invitation Homes Inc. Common Stock,United States,2017,NYSE,INVH
IO,Ion Geophysical Corporation Common Stock,United States,,NYSE,IO
IP,International Paper Company Common Stock,United States,,NYSE,IP
IPG,Interpublic Group of Companies Inc. (The) Common Stock,United States,,NYSE,IPG
IPI,Intrepid Potash Inc Common Stock,United States,2008,NYSE,IPI
IPOD,Social Capital Hedosophia Holdings Corp. IV Class A Ordinary Shares,United States,2020,NYSE,IPOD
IPOF,Social Capital Hedosophia Holdings Corp. VI Class A Ordinary Shares,United States,2020,NYSE,IPOF
IPVA,InterPrivate II Acquisition Corp. Class A Common Stock,,2021,NYSE,IPVA
IQI,Invesco Quality Municipal Income Trust Common Stock,United States,,NYSE,IQI
IQV,IQVIA Holdings Inc. Common Stock,United States,2013,NYSE,IQV
IR,Ingersoll Rand Inc. Common Stock,United States,2017,NYSE,IR
IRL,New Ireland Fund Inc (The) Common Stock,United States,1990,NYSE,IRL
IRM,Iron Mountain Incorporated (Delaware)Common Stock REIT,United States,,NYSE,IRM
IRS,IRSA Inversiones Y Representaciones S.A. Common Stock,Argentina,,NYSE,IRS
IRT,Independence Realty Trust Inc. Common Stock,United States,2013,NYSE,IRT
IS,ironSource Ltd. Class A Ordinary Shares,,2021,NYSE,IS
ISD,PGIM High Yield Bond Fund Inc.,United States,2012,NYSE,ISD
ISOS,Isos Acquisition Corporation Class A Ordinary Shares,,2021,NYSE,ISOS
IT,Gartner Inc. Common Stock,United States,1993,NYSE,IT
ITCB,Itau CorpBanca American Depositary Shares (each representing 1500 shares of Common Stock no par value),Chile,,NYSE,ITCB
ITGR,Integer Holdings Corporation Common Stock,United States,,NYSE,ITGR
ITT,ITT Inc. Common Stock ,United States,2011,NYSE,ITT
ITUB,Itau Unibanco Banco Holding SA American Depositary Shares (Each repstg 500 Preferred shares),Brazil,,NYSE,ITUB
ITW,Illinois Tool Works Inc. Common Stock,United States,,NYSE,ITW
IVAN,Ivanhoe Capital Acquisition Corp. Class A Ordinary Shares,,2021,NYSE,IVAN
IVC,Invacare Corporation Common Stock,United States,,NYSE,IVC
IVH,Delaware Ivy High Income Opportunities Fund,,2013,NYSE,IVH
IVR,INVESCO MORTGAGE CAPITAL INC Common Stock,United States,2009,NYSE,IVR
IVR^B,Invesco Mortgage Capital Inc. Preferred Series B Cum Fxd to Fltg,United States,,NYSE,IVR.B
IVR^C,INVESCO MORTGAGE CAPITAL INC 7.5% Fixed-to-Floating Series C Cumulative Redeemable Preferred Stock Liquation Preference $25.00 per Share,United States,,NYSE,IVR.C
IVZ,Invesco Ltd Common Stock,United States,,NYSE,IVZ
IX,Orix Corp Ads Common Stock,Japan,,NYSE,IX
J,Jacobs Engineering Group Inc. Common Stock,United States,,NYSE,J
JAX,J. Alexander's Holdings Inc. Common Stock,,2015,NYSE,JAX
JBGS,JBG SMITH Properties Common Shares ,United States,2017,NYSE,JBGS
JBI,Janus International Group Inc. Common Stock,,2021,NYSE,JBI
JBL,Jabil Inc. Common Stock,United States,1993,NYSE,JBL
JBT,John Bean Technologies Corporation Common Stock,United States,,NYSE,JBT
JCE,Nuveen Core Equity Alpha Fund Nuveen Core Equity Alpha Fund Common Shares of Beneficial Interest,United States,2007,NYSE,JCE
JCI,Johnson Controls International plc Ordinary Share,Switzerland,,NYSE,JCI
JCO,Nuveen Credit Opportunities 2022 Target Term Fund Common Shares of Beneficial Interest,United States,2017,NYSE,JCO
JDD,Nuveen Diversified Dividend and Income Fund Shares of Beneficial Interest,United States,2003,NYSE,JDD
JEF,Jefferies Financial Group Inc. Common Stock,United States,,NYSE,JEF
JELD,JELD-WEN Holding Inc. Common Stock,United States,2017,NYSE,JELD
JEMD,Nuveen Emerging Markets Debt 2022 Target Term Fund Common Shares of Beneficial Interest $0.01 par value per share,,2017,NYSE,JEMD
JEQ,Aberdeen Japan Equity Fund Inc.  Common Stock,United States,1992,NYSE,JEQ
JFR,Nuveen Floating Rate Income Fund Common Stock,United States,2004,NYSE,JFR
JGH,Nuveen Global High Income Fund Common Shares of Beneficial Interest,United States,2014,NYSE,JGH
JHAA,Nuveen Corporate Income 2023 Target Term Fund,,2018,NYSE,JHAA
JHB,Nuveen Corporate Income November 2021 Target Term Fund,,2016,NYSE,JHB
JHG,Janus Henderson Group plc Ordinary Shares,,2017,NYSE,JHG
JHI,John Hancock Investors Trust Common Stock,United States,,NYSE,JHI
JHS,John Hancock Income Securities Trust Common Stock,United States,,NYSE,JHS
JHX,James Hardie Industries plc American Depositary Shares (Ireland),Ireland,,NYSE,JHX
JILL,J. Jill Inc. Common Stock,,2017,NYSE,JILL
JKS,JinkoSolar Holding Company Limited American Depositary Shares (each representing 4 Common Shares),China,2010,NYSE,JKS
JLL,Jones Lang LaSalle Incorporated Common Stock,United States,,NYSE,JLL
JLS,Nuveen Mortgage and Income Fund,United States,2009,NYSE,JLS
